id,user_name,user_privilege,level,reply_count,up_count,down_count,client_type,comment
907690238,微信用户1463788305070798,,lv2,0, , ,iPhone客户端,千金大小
907682999,土豆用户_421641039,,lv4,0,1, ,iPad客户端,这部剧再大的缺点就是广告植入的太丧心病狂了
907659577,uv聪聪vu,,lv40,0,1, ,iPhone客户端,邱莹莹是有多少个手机啊，也是醉了！
907655454,支付宝用户62800989,,lv9,0,1, ,Android客户端,太喜欢魏渭扮演的感觉，大气稳重，广告着急的朋友没关系，发个评论呗
907649106,腾讯用户1463798120670607,,lv9,0, , ,iPad客户端,I&#039;m the CFO
907601928,优酷用户857281315,,lv7,1, , ,iPad客户端,搞
907601885,优酷用户857281315,,lv7,0,1, ,iPad客户端,已转发评论
907569876,,,lv40,0, , ,Android客户端,"<img src=""http:\/\/static.youku.com\/v1.0.157\/index\/img\/smiley\/Yo17.gif"" alt=""赞"" title=""赞"" \/>"
907533463,君去何方,,lv28,0, , ,优酷,靠，要是领导这样整我，早就搞了他
907521865,蓉蓉16908454,,lv9,0,1, ,iPhone客户端,宝马男不是外地的吗？怎么跟他们一样的上海车牌？
907483731,柳儿飘舞,,lv56,0,2, ,优酷,太假了吧，还以为是80年代啊，这样对待员工，等着做光杆司令吧
907481440,____68483007,,lv10,0, , ,优酷,"<a title=""点击从此时间点开始播放"" alt=""点击从此时间点开始播放"" href=""javascript:PlayerSeekMin('00','115');window.scroll(0,0)"">115秒"
907480345,WangYiHao39543021,,lv14,0, , ,iPad客户端,已转发评论
907466688,小正太灬丶,,lv41,0,2, ,优酷,邱莹莹怎么老哭，也是醉了 。。。
907429769,伤风败恕,,lv25,0, , ,优酷PC客户端,我听到了继承者的背景音乐- -
907336150,sTamB,,lv21,0, , ,iPhone客户端,好啰嗦广告还多😩
907297679,,,lv37,0, , ,iPhone客户端,520 我和你
907296828,春然39435613,,lv19,0, , ,iPhone客户端,不喜欢魏谓的配音
907287173,灬掌柜,,lv26,0, , ,Android客户端,这就是禁止办公室恋情的原因吧
907286271,灬掌柜,,lv26,0, , ,Android客户端,关关说话慢吞吞的，急人
907213236,支付宝用户59886356,,lv6,0, , ,iPhone客户端,万恶广告
907194001,,,lv36,0, , ,iPad客户端,邱莹莹演的太浮夸感觉有点弱智
907104315,老姜五毛钱一斤,,lv32,1,1, ,优酷PC客户端,为什么每次关关打电话都是在上厕所
907103029,微博用户1463661586609469,,lv1,0,1, ,优酷iku,刚来看
907094771,手机用户_456021630,,lv20,0, , ,iPad客户端,杨颖这个广告她的眉毛化的都不对称
907089883,社会牛逼拉,,lv34,0, , ,优酷PC客户端,15545
907086470,微信用户146272928207544,,lv8,0, , ,Android客户端,既然是欢乐，结局安迪怎么没和老魏呢？
907074259,erfas,,lv8,0,1, ,iPhone客户端,广告次数又多又长
907067183,Kevin29497569,,lv8,0,1, ,iPad客户端,安迪老板明显喜欢安迪啊，怎么没行动
907062899,Kevin29497569,,lv8,0,2, ,iPad客户端,我喜欢安迪，时刻洋溢的笃定，自信
907062022,腾讯用户1463654835607481,,lv4,2,1, ,Android客户端,"<a href=""http:\/\/comments.youku.com\/star_page\/uid_UNzc2MzI4.html"" target=""_blank"">王凯"
907060920,大坤101,,lv51,0, , ,优酷PC客户端,1111
907053502,长空绝迹,,lv27,0, , ,优酷PC客户端,评论呢
907030751,腾讯用户1461992650254681,,lv4,0,2, ,优酷PC客户端,白渣男好贱，好贱，好贱
907030583,asdweiling,,lv39,0,1, ,iPad客户端,好奇这个樊姐工作的地方
907030354,腾讯用户1461992650254681,,lv4,0, , ,优酷PC客户端,好好看哦
907022233,芹子鼠,,lv19,0,2, ,Android客户端,广告时间可以上个厕所洗个脸
907003976,微信用户1463553570021458,,lv3,0,1, ,Android客户端,感觉莹莹和樊姐之间像是母女在对话，很别扭，但也很有爱
906960978,刘娟娟80935,,lv39,0, , ,iPhone客户端,这个白渣男真她娘的猥琐
906928224,腾讯用户1463631786785747,,lv5,0, , ,Android客户端,涛涛😆
906898486,LOL娱乐解说小一,,lv21,0, , ,优酷,点我看最新一期搞笑与激情于一身的解说！吃饭时候别看，保证让您笑。如果不笑，只能说明你没听懂。呵呵！我在我家等你们。路过进来喝点茶水。
906886099,伊小q,,lv7,0, , ,iPhone客户端,也没那么好看
906869976,花叶果01268818,,lv17,0, , ,Android客户端,我要是能这样大哭就好了。
906869680,花叶果01268818,,lv17,0, , ,Android客户端,哎呀，我也好烦小蚯蚓总是哭啊
906867907,花叶果01268818,,lv17,0, , ,Android客户端,安迪的职业装真好看
906867590,花叶果01268818,,lv17,0, , ,Android客户端,呵呵，不要在意这些个细节
906841192,zaijian理想,,lv12,0, , ,Android客户端,这广告时间尼玛的太长了
906837766,博踏飞燕,,lv31,0, , ,Android客户端,公司有这种渣男做财务，离破产也不远了！
906815825,,,lv19,0, , ,iPhone客户端,还有没有哭完啊？烦死了。。。
906804149,,,lv29,0, , ,iPad客户端,’
906801539,hfjm0205,,lv24,0, , ,优酷PC客户端,首先你的像他爸爸一样有钱。
906797620,chenqi407,,lv48,0, , ,Android客户端,"<a href=""http:\/\/comments.youku.com\/star_page\/uid_UODg0MTY=.html"" target=""_blank"">杨紫"
906789330,腾讯用户1461567436520437,,lv6,0, , ,Android客户端,扬紫在大秧歌里面就不怎么样现在更差了
906785059,榴芒遇上冰,,lv17,0, , ,iPhone客户端,喜欢小曲，性格开朗活泼，有这样的女儿多好！
906783311,紫瓷青砂,,lv8,0, , ,优酷iku,喜欢小曲，好羡慕她的随性洒脱
906781225,微信用户1463450903933913,,lv4,0, , ,iPhone客户端,每个人各有特色，很现实，很好看！
906777247,,,lv42,0, , ,优酷,不戴眼镜好看点
906772034,甜蜜的负担84596915,,lv23,0, , ,优酷PC客户端,安迪的弟弟找到了吗？是谁？
906771937,Jenny85967758,,lv12,0, , ,iPhone客户端,我以前跟
906761542,Jenny85967758,,lv12,0, , ,iPhone客户端,觉得小曲还不错，真实不做作，正如她说的，那几个的确拎不清，傻里傻气的，缺少社会经验，只有安迪她才瞧得上，不是因为安迪有钱，而是她觉得那几个太幼稚吧，虽然说话犀利，但是挺实在的
906742658,神樂醬,,lv25,0, , ,优酷iku,这个什么经理。。。 自己会不会办事啊
906742335,,,lv39,0, , ,Android客户端,会员了，还要看广告，
906740702,X天浮X,,lv23,0, , ,Android客户端,这广告也是绝了
906738922,哭泣の拳头,,lv30,0, , ,优酷,老谭----------酸菜、
906733502,鸟与花香68481109,,lv4,1, , ,Android客户端,这个电视剧全是无痕的广告植入
906721363,,,lv6,0, , ,Android客户端,这个奇点就是潜伏里面的李涯
906713271,,,lv18,0, , ,优酷,贱货
906708109,qzuser27268723,,lv10,0, , ,iPad客户端,鹿晗鹿晗
906696798,,,lv38,0, , ,优酷PC客户端,小邱领导更年期，我没有一个领导这样
906686529,腾讯用户1463282275031390,,lv3,0, , ,iPhone客户端,安迪
906661891,优酷用户1463560764167950,,lv1,0, , ,优酷移动播放页,。。。不喜欢就别看瞎比比啥
906653450,,,lv25,0, , ,iPhone客户端,去哪里找这么好的老板
906626667,离曲一殇与谁眠,,lv29,0, , ,iPad客户端,感觉
906623178,优酷用户807869504,,lv10,0, , ,iPhone客户端,"<img src=""http:\/\/static.youku.com\/v1.0.157\/index\/img\/smiley\/Yo17.gif"" alt=""赞"" title=""赞"" \/>"
906623122,土豆用户_487812101,,lv22,0,1, ,iPad客户端,已转发评论
906623079,土豆用户_487812101,,lv22,0,1, ,iPad客户端,已转发评论
906590394,暮琳子,,lv12,0, , ,iPad客户端,护眼
906561793,土豆用户_461477399,,lv24,0, , ,Android客户端,应该是那个白渣男的室友，就那个作证的那个。
906528423,ykapp_c9zxeobl,,lv12,0, , ,iPhone客户端,"<a href=""http:\/\/comments.youku.com\/star_page\/uid_UODg0MTY=.html"" target=""_blank"">杨紫"
906479177,,,lv23,0,1, ,iPhone客户端,姓白的就是人渣
906457144,心隐范i,,lv10,0,1, ,优酷PC客户端,没有吧才
906438048,,,lv15,0,2, ,iPad客户端,已转发评论
906426850,卒或兵,,lv46,0,1, ,优酷PC客户端,，莹莹怎么傻了，有时候资历和一段时间的运气有关系。
906354272,如果情绪可,,lv22,1,4, ,iPhone客户端,中间插了
906332768,AX63154061,,lv6,0,1, ,Android客户端,广告好多
906329809,优雅的大红萝卜,,lv7,0,1, ,iPhone客户端,是啊被玩了被甩了
906326216,优雅的大红萝卜,,lv7,0, , ,iPhone客户端,邱莹莹真是够了
906302979,多巴胺suger,,lv24,0, , ,优酷PC客户端,我以为 我很傻，邱莹莹也很傻，像我和邱莹莹这种级别的又傻长相又普通的人还是单着好了，免得被骗。
906250137,满满的回忆47837355,,lv10,0, , ,iPhone客户端,莹莹其实挺可爱的，很呆萌，很赞的角色
906248071,,,lv9,0, , ,Android客户端,"<a href=""http:\/\/comments.youku.com\/star_page\/uid_UODg0MTY=.html"" target=""_blank"">杨紫"
906245730,腾讯用户1463049136805521,,lv3,0, , ,优酷PC客户端,就是的
906245422,腾讯用户1463049136805521,,lv3,0, , ,优酷PC客户端,不好看
906229162,,,lv26,0,1, ,Android客户端,。。。。。
906212978,腾讯用户1463305540910598,,lv4,0, , ,优酷iku,切实际的长相会看吗
906205360,,,lv44,1, , ,iPad客户端,翻墙上推是越狱上推特吧
906204069,微信用户1463310794980298,,lv6,0, , ,Android客户端,广告太多
906203963,微信用户1463310794980298,,lv6,0,1, ,Android客户端,广告太多
906189768,,,lv32,0,1, ,iPad客户端,其实小关不戴眼镜是很漂亮的。。
906181218,看看热闹呗，呸,,lv14,0, , ,优酷,翻墙就是翻阅屏蔽中国与海外的那堵墙，上推就是上推特，有点像海外的博客，很受欢迎
906164764,微信用户1463305978090755,,lv7,0, , ,iPhone客户端,广告时间才看评论……
906151897,,,lv23,0, , ,优酷,"<a href=""http:\/\/comments.youku.com\/star_page\/uid_UODg0MTY=.html"" target=""_blank"">杨紫"
906139442,,,lv18,0, , ,iPhone客户端,财务报销怎么能用铅笔签名呀
906139065,,,lv24,0, , ,iPhone客户端,"<a href=""http:\/\/comments.youku.com\/star_page\/uid_UODg0MTY=.html"" target=""_blank"">杨紫"
906126168,,,lv59,0, , ,优酷,这个角色刻画的很好，真他妈的活该
906119762,,,lv49,0, , ,iPhone客户端,"<a href=""http:\/\/comments.youku.com\/star_page\/uid_UODg0MTY=.html"" target=""_blank"">杨紫"
906106592,全铖,,lv12,0,1, ,优酷iku,老干部当超级备胎，哎。。~~~~(&gt;_&lt;)~~~~
906105614,全铖,,lv12,0, , ,优酷iku,邱莹莹怎么就那么犯贱- - 喜欢这种渣男╮(╯▽╰)╭
906101663,银空侠客,,lv43,1,1, ,iPad客户端,莹莹手机老换，谁发现了
906096689,,,lv18,0, , ,优酷PC客户端,喜欢安迪，
906034280,诺锦华,,lv18,1, , ,iPad客户端,不是
905988488,尐吜渔う,,lv23,0, , ,优酷,好看吗？感觉我还是喜欢
905985475,0danny0,,lv24,0,1, ,iPhone客户端,妈蛋的看剧进度无记录 换一集可以看一分多钟广告 优酷真特么有手段
905979114,小丑19928693,,lv19,0, , ,iPhone客户端,过来人看一切都是生活的常态，矫情与尴尬的剧情深入了人心便是演技。
905977726,大萍子17500791,,lv15,0,2, ,iPhone客户端,王的车一看就是租来的。牌照都是沪的
905963811,二月143B9,,lv11,0,2, ,iPhone客户端,我真的很不喜欢邱莹莹 但是我不得不承认我真的是这种人 冲动情商低智商低 不求上进不爱考试
905940450,毛里求斯姑娘,,lv13,0, , ,iPad客户端,特喜欢安迪
905886856,绵小羊呵呵,,lv33,0, , ,优酷PC客户端,这个邱莹莹蠢得可以啊，我不信哪个大学出来能这么蠢
905873919,lisalei6,,lv15,0, , ,iPhone客户端,"<a href=""http:\/\/comments.youku.com\/star_page\/uid_UNjc2NzY=.html"" target=""_blank"">刘涛"
905859877,wspjq,,lv10,0, , ,优酷iku,做假账。。
905828546,,,lv22,0,1, ,Android客户端,这个邱莹莹也太没用了，就知道哭
905806897,,,lv6,1,1, ,优酷,安迪的弟弟是不是就是网友？？？
905799123,吉祥如意2015,,lv7,0, , ,优酷iku,这波可以的
905779966,,,lv36,0, , ,优酷PC客户端,怎么看不到评论
905776906,,,lv33,0, , ,Android客户端,😄
905763289,anshiniuniu,,lv20,0, , ,iPhone客户端,"<a href=""http:\/\/comments.youku.com\/star_page\/uid_UNjY2OTI=.html"" target=""_blank"">蒋欣"
905761957,看我怎样脑残,,lv12,0,1, ,Android客户端,东鹏，我喝了是龟儿子
905751485,椒椒YY,,lv20,0,1, ,iPhone客户端,我曾经也是炸炸呼呼没大脑的 现在想想以前太可笑了
905742808,,,lv9,0, , ,iPhone客户端,邱莹莹这样的已经灭种了，哪有那么傻的还
905708891,天空之翼89952112,,lv25,0, , ,Android客户端,这个电视剧这样拍个有意思呀，那个人渣，还没有完，这个女的想死缠烂打呀
905699208,米娅家族---梦菲,,lv21,0, , ,Android客户端,白渣男
905675376,,,lv9,0, , ,优酷,东鹏再也不喝你了
905674472,,,lv21,0, , ,Android客户端,这是扯淡
905674403,,,lv21,0, , ,Android客户端,不行不够上面
905673745,,,lv21,0, , ,Android客户端,纯情
905672529,优酷院线63458625,,lv20,0, , ,iPhone客户端,攀小美心里有什么苦啊
905667499,,,lv7,0,2, ,优酷,邱莹莹长得还是不错的，这样的美女会等到公司主管来骗？也太小看大学中学里的渣男了，这个角色塑造得不切实际……
905657575,歆sssss,,lv21,0, , ,iPad客户端,6
905652604,加油飞吧86854793,,lv8,0, , ,iPad客户端,邱莹莹也不是好惹的！白渣男工作也丢了！谁怕谁
905649053,,,lv48,0, , ,优酷,搞你啊
905644512,美美乔,,lv50,0, , ,Android客户端,可怜的莹莹啊～被他骗了还得看他脸色
905640884,美美乔,,lv50,0, , ,Android客户端,财务主管怎么那么穷那么猥琐啊
905631022,,,lv41,0, , ,优酷iku,东 鹏你奶奶个哨子
905630317,閞杺乄尒ふ,,lv37,0, , ,iPhone客户端,公司财务有这样的？我就是财务啊，报销哪敢这样啊还是部门经理的报销！
905613167,,,lv29,0, , ,iPad客户端,好喜欢老谭啊啊啊啊啊
905609806,她说我是最可爱的猪,,lv2,0, , ,优酷,卧槽 土豆真特么贱 看一集两个插播广告 时间还特别长 草
905606547,微信用户1461419698669232,,lv8,0, , ,iPhone客户端,她们怎么经常换手机啊，早上见邱莹莹的手机不是iPhone，和小关通话是马上变成iPhone了 ，她们有专门打电话的手机
905606453,优酷用户1461300505435939,,lv2,0, , ,优酷,其实不管安迪发生什么事都是老谭默默的陪在安迪身边
905601145,腾讯用户1463304589842571,,lv1,0, , ,Android客户端,哈哈哈
905595389,雪梨哥哥,,lv47,0, , ,优酷,我只喜欢关关。
905579849,微信用户1462019449441604,,lv12,1,1, ,Android客户端,广告越长越让人反感，反而让广告白打，因为到了广告时间长都会静音不看，抽支烟后再看广告就没了
905575773,腾讯用户1463304190483205,,lv2,0,1, ,Android客户端,光看广告行了
905575594,-月光查理-,,lv20,0, , ,Android客户端,广告好多
905564816,支付宝用户51096512,,lv8,1, , ,iPhone客户端,这她娘的
905560041,为你最后一次流泪,,lv23,0, , ,优酷PC客户端,在电脑上下载优酷的客户端没有广告，一点都不卡很棒
905558032,灵灵72770824,,lv14,0, , ,Android客户端,这广告也太久了吧，我都想举报了啊
905549173,土豆用户_731939431,,lv1,0, , ,Android客户端,邱莹莹演的比我还笨
905540861,_小B瑩Sakura,,lv21,0,1, ,iPhone客户端,其实我想说，这邱莹莹傻呀！内渣男都做到这份儿上了！还看什么看，要是我，看他一眼都嫌脏了我眼！
905539517,slqfeliz,,lv21,0,1, ,iPad客户端,广告好短哦
905532231,,,lv71,0,1, ,Android客户端,白主管的猥琐演技不错啊，演的真猥琐
905529604,,,lv35,0, , ,优酷iku,优酷会员就是好，没广告，还1080P
905527473,梦幻永远那么的美,,lv20,0, , ,iPad客户端,魏渭好老啊💩💩💩
905519463,土豆用户_389533250,,lv15,0,1, ,Android客户端,怎个意思 加那么多广告 
905516531,土豆用户_389533250,,lv15,0, , ,Android客户端,觉得 我说的对 都来吐槽优酷
905516110,土豆用户_389533250,,lv15,0, , ,Android客户端,一百多分钟广告 还能能让人好好看了
905514654,守候唯一的幸福73018819,,lv3,0, , ,优酷移动播放页,很好看
905506284,微信用户1463301303154249,,lv5,0, , ,iPhone客户端,邱邱的遭遇其实是自己不认真的结果，第一不认真工作，不求上进，总玩手机，不在工作上努力。第二生活不认真，即使选男朋友也只看外表，不看一个人做事的态度和人品。
905488993,樱满真名酱,,lv10,0, , ,iPad客户端,大家一起喊 打死渣男
905471332,微信用户1463150130492188,,lv4,0,1, ,优酷,110广告
905470105,AWC1202,,lv15,0, , ,Android客户端,邱莹莹演的很好，虽然比我蠢
905465374,荣耀殿堂,,lv48,0, , ,优酷PC客户端,有点话加我QQ哦本人QQ175502572
905465226,荣耀殿堂,,lv48,0, , ,优酷PC客户端,有妹纸吗
905465130,周一76067091,,lv22,0,1, ,iPad客户端,真想把白主管那个渣男打死，女孩子找男朋友还真得擦亮眼睛，千万不能瞎
905454989,ZBT-954,,lv35,0,2, ,优酷iku,说实话我感觉很真实
905454384,独孤剑客杨,,lv12,0,1, ,Android客户端,三千世界，众生相
905451190,VV国王vv,,lv43,0, , ,Android客户端,我长的帅嘛？人家都说我长的帅
905448370,段跃云,,lv18,0, , ,Android客户端,电视剧一定要接地气，
905443991,微信用户1463240883428983,,lv5,0, , ,Android客户端,"<a href=""http:\/\/comments.youku.com\/star_page\/uid_UODg0MTY=.html"" target=""_blank"">杨紫"
905436497,微信用户1463235734869574,,lv4,0, , ,iPhone客户端,国内的电视剧，女主都太普通，无论长相衣着，根本看不到一点时尚的元素，跟韩剧始终都有很大的距离，韩剧每看一部都会学到些时尚或者将要流行的东西，女演员也一样，都很有各自不同的特色.......国内拍来拍去也就这几个
905435804,优酷用户1463289577349477,,lv5,0, , ,Android客户端,我感觉小蚯蚓有点像我
905435238,胭脂醉84384134,,lv17,0,1, ,优酷PC客户端,"<a href=""http:\/\/comments.youku.com\/star_page\/uid_UNTA5MDg=.html"" target=""_blank"">靳东"
905430782,ツ笙歌绝丶57797401,,lv27,1, , ,优酷iku,就是
905421528,壹原抚子,,lv23,0,1, ,iPad客户端,老谭人真好，温润如玉，心细如发。
905419558,辛泽007,,lv38,0, , ,优酷PC客户端,、、、、
905410256,,,lv25,0, , ,优酷PC客户端,喜欢关关
905407820,手机用户_394139342,,lv29,1, , ,Android Pad客户端,邱莹莹真是个傻瓜
905404971,莲子66684629,,lv7,0, , ,iPhone客户端,6
905404863,Mattinata36209359,,lv3,0, , ,Android客户端,恩，唯品会的减价品都是有些微瑕
905403381,莲子66684629,,lv7,0,1, ,iPhone客户端,喜欢曲xiaoxiao
905400667,紫龙FC,,lv11,0, , ,Android客户端,安迪的弟弟，会不会是樊胜美的宝马同学
905400173,我真不是籽岷,,lv17,0, , ,iPad客户端,老是广告～时不时就广告～烦不烦啊。
905391851,,,lv17,0, , ,优酷,心理障碍、精神病、智力低下，这三样不是一个概念吧！
905373514,微博用户1463281252237677,,lv3,0, , ,优酷iku,我感觉电脑看好像比手机看要少很多广告啊，开头不到五十秒中间不插播广告
905368977,,,lv44,0, , ,优酷iku,66 6 6 66 6 66 6 6 6 6 6 6 6
905365103,虚心学吉他的小站,,lv8,0, , ,优酷PC客户端,老谭还真是个好男人啊
905362216,腾讯用户7651490612140578,,lv9,0, , ,Android客户端,已转发评论
905362192,腾讯用户7651490612140578,,lv9,0, , ,Android客户端,已转发评论
905352070,老子迟早有腹,,lv27,0,1, ,优酷PC客户端,哭的跟啥比是的
905348272,支付宝用户146228711629673,,lv4,0, , ,优酷iku,说好的会员没广告呢
905346029,,,lv21,0, , ,iPhone客户端,邱莹莹看事情太表面
905308802,丫丫逸雪,,lv7,0, , ,iPad客户端,已转发评论
905235421,kidssnake,,lv29,0, , ,iPad客户端,只能说眼光独到
905233957,kidssnake,,lv29,0,1, ,iPad客户端,已转发评论
905230760,优酷用户860477487,,lv3,1, , ,iPhone客户端,特烦淫淫 不应该设这角色…
905221698,花开那年27349529,,lv15,1,1, ,优酷iku,老谭就是来送温暖得。
905221571,花开那年27349529,,lv15,0,1, ,优酷iku,就是来送温暖的。
905205290,aisiyingzi,,lv21,0, , ,优酷PC客户端,222
905188940,,,lv26,0, , ,iPhone客户端,可怜的盈盈
905186917,,,lv31,0,2, ,iPhone客户端,白渣男真丑。
905179494,路虎36201088,,lv7,0, , ,iPhone客户端,除了哭还会干什么
905174555,炫42279468,,lv17,0, , ,Android客户端,好看
905173973,蜕变成潮,,lv16,0,1, ,iPhone客户端,樊姐对男人有手腕，钓胃口还没吃完饭就要回家
905166206,把情烙进哩,,lv26,0,1, ,优酷,如果我是老板就把邱邱炒了
905156637,,,lv30,0,2, ,优酷,说实话，关关好美
905156050,爱大海22847254,,lv6,0, , ,Android客户端,电视剧太假了看不下去了请问下中国的导演，你们敢不敢拍一些真实的东西？职场有你们这样拍吗。有那么美好吗
905138131,superman6799,,lv28,0, , ,优酷,看着不错；，喜欢每个角色
905133956,,,lv52,0, , ,优酷,很好 很强大
905117218,,,lv34,1,1, ,优酷,那个姓魏的奇点，是安迪的弟弟?看到了第8集
905110508,soulmate30538146,,lv5,0, , ,Android客户端,我举报此处有人装逼😂😂
905110386,_110993148,,lv8,0,1, ,iPhone客户端,我爱薛之谦我爱薛之谦我爱薛之谦我爱薛之谦我爱薛之谦我爱薛之谦我爱薛之谦我爱薛之谦我爱薛之谦我爱薛之谦我爱薛之谦我爱薛之谦我爱薛之谦我爱薛之谦我爱薛之谦我爱薛之谦我爱薛之谦我爱薛之谦我爱薛之谦我爱薛之谦我爱薛之谦我爱薛之谦我爱薛之谦我爱薛之谦我爱薛之谦我爱薛之谦我爱薛之谦我爱薛之谦我爱薛之谦我爱薛之谦我爱薛之谦我爱薛之谦我爱薛之谦我爱薛之谦我爱薛之谦我爱薛之谦我爱薛之谦我爱薛之谦我爱薛之谦我爱薛之谦我爱薛之谦我爱薛之谦我爱薛之谦我爱薛之谦我爱薛之谦我爱薛之谦我爱薛之谦我爱薛之谦我爱薛之谦我爱薛之谦我爱薛之谦我爱薛之谦我爱薛之谦我爱薛之谦我爱薛之谦我爱薛之谦我爱薛之谦我爱薛之谦我爱薛之谦我爱薛之谦
905109661,土豆用户_727718203,,lv3,0,2, ,Android客户端,完了 优酷败在广告上了
905099370,실망01981599,,lv4,0, , ,优酷PC客户端,太好看了
905077147,优酷手机用户_ots4jcge,,lv15,0,1, ,Android客户端,那个奇点是不是在“潜伏”里面演李涯的那个演员？
905073645,手机用户_384899681,,lv16,0, , ,iPhone客户端,怎么搞的会员还有广告啊
905063291,腾讯用户1463111054725171,,lv2,0,2, ,优酷PC客户端,邱莹莹是个败笔 每次看到我都一律快进，过于浮夸。被人搞了还不辞职，脸都不要了？
905062280,腾讯用户1463111054725171,,lv2,0, , ,优酷PC客户端,的
905042121,优酷用户1463158451620235,,lv1,0,1, ,iPhone客户端,不是很喜欢…那个呆呆的学霸一样的女孩儿
905041028,优酷用户1463158451620235,,lv1,0,3, ,iPhone客户端,"<a href=""http:\/\/comments.youku.com\/star_page\/uid_UNjc2NzY=.html"" target=""_blank"">刘涛"
905032630,,,lv17,0,2, ,优酷,邱莹莹是个败笔每次看到我都一律快进，过于浮亏。被人搞了还不辞职，脸都不要了？
905031220,小萱0811,,lv16,1, , ,iPad客户端,什么是翻墙上推
905029984,优酷手机用户_lopeoo5w,,lv24,0, , ,优酷PC客户端,额
905029829,小萱0811,,lv16,0,1, ,iPad客户端,woc 车上那段真的是显现出秋莹莹的白痴形象
905028884,神的左手57670843,,lv5,0, , ,iPad客户端,都说女经理如何，难道这样的职员就应该一再都
905019382,,,lv48,0, , ,iPhone客户端,不管上什么班自己的本职工作最起码要做好
905016981,Hello__47608162,,lv6,0, , ,iPhone客户端,老谭，太假了，作
904997159,,,lv48,0, , ,iPhone客户端,好看
904994376,土豆用户_358477638,,lv30,2,1, ,Android客户端,关关是个大美女，我会捧场，花二亿买这部电视剧的收视率，顶你。
904986813,,,lv41,0, , ,Android客户端,林师兄？？？这么猥琐
904976803,口kou我,,lv38,0,2, ,iPod客户端,演曲筱绡的
904965534,静47360749,,lv11,0,1, ,优酷PC客户端,我日邱莹莹手机一直换的啊
904924134,晨晨麻麻31713001,,lv19,0, , ,Android客户端,一看见奇点就想起潜伏里的李崖，就觉得他不是好人，不喜欢奇点，喜欢老谭
904923243,晨晨麻麻31713001,,lv19,0, , ,Android客户端,"<a href=""http:\/\/comments.youku.com\/star_page\/uid_UNjY2OTI=.html"" target=""_blank"">蒋欣"
904921664,右氢,,lv2,0,1, ,优酷PC客户端,我挺喜欢这个小蚯蚓的 真实 敢爱敢恨
904920108,呵护缘分o,,lv4,0,1, ,优酷iku,怎么吧女孩演的那么傻啊！现在哪有傻女孩
904911398,大白兔829,,lv20,0, , ,优酷,"<img src=""http:\/\/static.youku.com\/v1.0.157\/index\/img\/vip_emotion\/wanwan\/bangjia.gif"" alt=""绑架"" title=""绑架"" \/>"
904893539,优酷手机用户_c79HqtA8,,lv10,0, , ,Android客户端,邱莹莹哭的好恶心
904887993,IOS_67jnEVEF,,lv24,0,1, ,iPad客户端,邱莹莹有病吧，跟小雪一点不像
904882959,腾讯用户1463035172274619,,lv4,0, , ,优酷PC客户端,我能说一开始播放就开始卡的buhuidong嘛
904874854,gouken001,,lv25,0, , ,优酷PC客户端,奇点角色单薄了。这样了还不趁虚而入，好好安慰？
904858540,yugiiwang,,lv27,0, , ,iPhone客户端,对剧中的人物不对演员，演员也只是在努力将角色演好，为每一个敢挑战不讨喜角色的演员点赞
904836188,优酷用户146234020617419,,lv4,0, , ,iPhone客户端,安迪
904830362,,,lv13,0, , ,优酷,这个女经理 家里死人了
