id,user_name,user_privilege,level,reply_count,up_count,down_count,client_type,comment
945052109,Legend沈少,,lv11,0, , ,优酷PC客户端,七点真猥琐
944512167,优酷用户1466476180009853,,lv8,0,1, ,优酷PC客户端,奇点太丑了，又恶心
944404268,娘们不毒怎能立足70427512,,lv6,0, , ,Android客户端,奇点真的渣，，后来还是因为他父母不同意，就放弃安迪了
944335201,,,lv44,0, , ,优酷PC客户端,meettoo 
944190734,腾讯用户80212702,,lv12,0, , ,iPad客户端,就是，谁说她没有弟弟的，看过原著吗你？
944075571,低调36226957,,lv12,0, , ,Android客户端,真好看。
943661531,我的黑怕,,lv28,0, , ,iPhone客户端,往往陪我们走到最后的都不是刚开始的那个人。
943657578,腾讯用户1467728941212588,,lv4,0, , ,iPad客户端,不喜欢奇点
943613233,北极寒冬,,lv20,0, , ,iPad客户端,。i 今后各国纷纷的 v 是擦S各种A（wrxddrh&#039;
943595199,,,lv10,0, , ,Android客户端,谭志明一身正气，奇点一脸猥琐样！
