id,user_name,user_privilege,level,reply_count,up_count,down_count,client_type,comment
898879580,支付宝用户49905283,,lv12,0, , ,iPad客户端,不是她傻 人总是主观上去选择自己想去相信的事情 她期盼小白是爱她的 也渴望自己的爱情情比金坚 不是她想不明白有些事情 而是刻意疲敝掉 一旦清醒 神马都明白了 有些事 朋友即便知道 但也不适合做 如果珍重一段感情就千万不要去试探 经不起试探的 最后伤的不过是自己
898874741,繁华似梦70780587,,lv7,0,1, ,Android客户端,樊胜美自己骗别人就行，别人骗她就不行！装成有钱人别人才看上自己的话，真实揭穿不就完了！
898873733,遗失在流年里的那份幸福67872572,,lv17,0, , ,Android客户端,"<a href=""http:\/\/comments.youku.com\/star_page\/uid_UODg0MTY=.html"" target=""_blank"">杨紫"
898869740,chengjingru03090389,,lv16,0, , ,优酷,不是她傻 人总是主观上去选择自己想去相信的事情 她期盼小白是爱她的 也渴望自己的爱情情比金坚 不是她想不明白有些事情 而是刻意疲敝掉 一旦清醒 神马都明白了 有些事 朋友即便知道 但也不适合做 如果珍重一段感情就千万不要去试探 经不起试探的 最后伤的不过是自己
898868406,腾讯用户1462017166746158,,lv3,0, , ,iPad客户端,"<a href=""http:\/\/comments.youku.com\/star_page\/uid_UNjc2NzY=.html"" target=""_blank"">刘涛"
898867985,繁华似梦70780587,,lv7,0,1, ,Android客户端,这也就是在剧里，要是在在现实生活中莹莹这种女的只会被人玩过再甩了，而且永远不会改过！
898865810,星轨xi,,lv15,0, , ,Android Pad客户端,为什么我看的时候总是有跳过的地方😭
898865382,腾讯用户1462017166746158,,lv3,1, , ,iPad客户端,"<a href=""http:\/\/comments.youku.com\/star_page\/uid_UMzQ4OTQ4MA==.html"" target=""_blank"">乔欣"
898864949,繁华似梦70780587,,lv7,0,1, ,Android客户端,莹莹是那种最适合被骗的人没脑子！一个劲倒贴！樊胜美就适合当小三爱钱，虚荣。曲筱绡太自以为是了，有点多管闲事
898862296,繁华似梦70780587,,lv7,0, , ,Android客户端,樊胜美太虚荣了！不现实活在梦里，还总想找高富帅，一把年纪了真和别人在一起了怎么装总会被人看清的！
898856535,盐炒栗子17666638,,lv4,0, , ,iPhone客户端,邱莹莹整个一焦躁症啊！毛病😒😒😒
898855958,盐炒栗子17666638,,lv4,0, , ,iPhone客户端,邱莹莹整个一焦躁症啊！有病！
898855216,叶子的南风天,,lv14,0, , ,优酷PC客户端,城会玩2333
898854352,安妍夕,,lv26,0, , ,优酷PC客户端,其实我觉得
898852033,Nothing08931941,,lv6,0, , ,Android客户端,好讨厌蚯莹莹
898848034,ykapp_qxpowl1y,,lv12,0, , ,Android客户端,画外音的老干部声音是此剧最大的败笔
898846772,叶子的南风天,,lv14,0,1, ,优酷PC客户端,我觉得曲没什么不对的
898846485,腾讯用户1462017166746158,,lv3,0,2, ,iPad客户端,虽然我也喜欢
898846413,,,lv39,0, , ,优酷,白主管演技真的好，比我室友还要猥琐...
898845709,細水成殤,,lv14,0, , ,优酷PC客户端,这样显得
898844815,优酷用户811306787,,lv14,0, , ,iPhone客户端,"<a href=""http:\/\/comments.youku.com\/star_page\/uid_UODg0MTY=.html"" target=""_blank"">杨紫"
898842278,腾讯用户1462017166746158,,lv3,0, , ,iPad客户端,都是势利眼！
898839261,糊鹿娃08525322,,lv12,0,1, ,Android客户端,邱滢滢这个角色的确不怎么讨喜
898838689,ykapp_qxpowl1y,,lv12,0,1, ,Android客户端,小蚯蚓这智商。。长得再漂亮，男人也不会珍惜，太傻了
898838006,一叶之秋35656439,,lv18,0, , ,优酷PC客户端,这个盘白好出戏啊
898827686,古75675919,,lv8,0, , ,优酷PC客户端,呢女是将看麦没梦想聊嫩快速
898827125,古75675919,,lv8,0, , ,优酷PC客户端,回去
898826850,ykapp_sn3o7nwb,,lv10,0, , ,优酷iku,恋爱本来就会让女生盲目的好吧。。。
898824694,不离不弃纯属童言无忌30183409,,lv2,0, , ,优酷PC客户端,为什么你们都说有广告，我的就一个广告也没有
898824482,不离不弃纯属童言无忌30183409,,lv2,0, , ,优酷PC客户端,我没广告
898820786,,,lv11,0, , ,Android客户端,奇点是谁啊。
898813132,讨厌看悲剧,,lv34,0, , ,优酷,美仕唐纳滋还要排好长队伍，真逗，这是骗谁呢，植入式广告真的是渗透的无处不在啊。
898812295,六月的雨60764435,,lv15,0,2, ,优酷PC客户端,那些吐槽邱莹莹智商的，不过是以旁观者的身份才能看的那么清楚而已。所谓成长，就是看过去的自己像个傻子。如果没有，要么是绝顶天才，要么还是傻子。
898810255,讨厌看悲剧,,lv34,0, , ,优酷,就是来上海看看市场的，买的车就上了沪牌，真是牛啊，哈哈~~
898795069,belong929,,lv42,0, , ,优酷iku,像说书似的。。
898784319,ykapp_qmeaz9vx,,lv24,0, , ,Android客户端,都是套路
898774923,达达桑123,,lv21,0, , ,优酷iku,你好厉害 的确是这样
898772840,ddwihpp,,lv17,0, , ,iPad客户端,曲小小把手机号放白主管口袋里了，晚上白主管肯定打电话给曲了呀
898770846,子衿草24904002,,lv8,0,1, ,iPhone客户端,卧槽，这么多广告
898770454,腾讯用户1462007416704389,,lv2,0, , ,优酷iku,渣男
898769767,腾讯用户1462007416704389,,lv2,0, , ,优酷iku,真有意思
898769121,我不如她59719984,,lv7,0, , ,优酷iku,我去
898768970,我不如她59719984,,lv7,0, , ,优酷iku,告诉我这旁白是什么情况
898765511,,,lv38,0, , ,iPad客户端,"<a href=""http:\/\/comments.youku.com\/star_page\/uid_UODg0MTY=.html"" target=""_blank"">杨紫"
898760843,我是吐槽小能手,,lv25,0,1, ,iPad客户端,只有我一个人特别喜欢关关嘛？
898759860,梦☺易碎➹,,lv17,0, , ,Android客户端,邱莹莹就是因为她自身内心原有的自卑感才会这样**吧，原本就是学历不高家境不好，好不容易搭上了公司的白主管自然是不愿意放弃这样一个男友，她清楚曲筱绡比她有资本赢得男人和其他的东西，所以不愿承认也不远去想，到底是她的男朋友禁不住诱惑还是根本不需要对那样男人感兴趣的邻居有错
898758592,好名起好名,,lv17,0, , ,iPad客户端,同感
898758521,好名起好名,,lv17,0, , ,iPad客户端,已转发评论
898758093,微信用户1462005717858776,,lv5,0,1, ,Android客户端,"<a href=""http:\/\/comments.youku.com\/star_page\/uid_UODg0MTY=.html"" target=""_blank"">杨紫"
898757880,梦☺易碎➹,,lv17,0,1, ,Android客户端,邱莹莹也太……天哪，听她说话我只想翻白眼
898755234,我是吐槽小能手,,lv25,0, , ,iPad客户端,还好有两个是杰伦的广告，要不然真看不下去。
898753845,时箩,,lv30,0, , ,优酷iku,话说这个小白到底是跑龙套的，还是当配角的啊
898753297,时箩,,lv30,0, , ,优酷iku,曲筱筱，邱莹莹，樊胜美，关雎尔，她们的名字已经被搜狗认识了，可以随意的连打出来了，果然是搜的人多了吗，
898752760,时箩,,lv30,0, , ,优酷iku,最好奇Andy会喝水在一起，起点，总是很容易的就让我想到起点中文网，该不会这个也是广告？
898752278,,,lv22,0, , ,Android客户端,感觉这剧就是
898751972,时箩,,lv30,0, , ,优酷iku,夜凉如水，小美抿嘴轻笑，踩着高跟鞋
898748888,址森,,lv13,0, , ,Android客户端,看个电视剧而已，也不要太过当真了。也不要因为一个角色就上升到演员本身，能让这么多人都不喜欢那个角色也正说明她演技好
898748342,zhanglan2004_0,,lv22,0, , ,iPhone客户端,已转发评论
898747132,,,lv35,0, , ,iPhone客户端,都说蚯蚓是因为爱情冲昏头才这样 我觉得不是 她不是单纯 是没脑子
898745878,loooeve2,,lv20,0,1, ,Android客户端,真心不错这电视剧 
898739346,我在安定区,,lv7,0, , ,优酷,看得我好尴尬
898736828,一千零一夜42471021,,lv29,0, , ,iPhone客户端,虚荣的女人
898734162,Wenpupil,,lv3,0, , ,优酷PC客户端,邱莹莹这么大人了 脑子这么？白痴？
898732909,空空如也98452968,,lv23,0,1, ,iPhone客户端,广告什么的去死
898725060,,,lv17,0, , ,iPhone客户端,"<a href=""http:\/\/comments.youku.com\/star_page\/uid_UNjc2NzY=.html"" target=""_blank"">刘涛"
898721384,树叶27381127,,lv13,0,2, ,iPhone客户端,都说
898720166,超级大头70486044,,lv5,0, , ,Android客户端,我想看华妃
898719987,晴天41048115,,lv24,0,1, ,Android客户端,觉得
898719734,栗栀酱,,lv31,0, , ,Android客户端,邱莹莹智障吗?简直像没见过男人一样
898718325,落跑嘉蔷,,lv38,0, , ,iPad客户端,富家女的逻辑，其实哪个女人不想自己魅力大？只是富家女更有资格做得肆无忌惮。
898716998,ykapp_rpwfr5ei,,lv13,2,6, ,优酷iku,觉得这部戏里
898712588,人潮拥挤我踹死你i78619195,,lv14,0,1, ,iPad客户端,"<a href=""http:\/\/comments.youku.com\/star_page\/uid_UODg0MTY=.html"" target=""_blank"">杨紫"
898712172,WendyCHU99829953,,lv36,0, , ,iPad客户端,不喜欢曲，帮朋友不是这个方式，超级讨厌她，一副尖酸刻薄相
898711175,愢竒蓶,,lv20,0, , ,Android客户端,服务员的声音比奇点难听
898710549,愢竒蓶,,lv20,0,1, ,Android客户端,奇点怎么这么丑
898709165,警警报暖心窝巧克力甜点私厨,,lv7,0, , ,Android客户端,吃烙饼那部分演的好假啊，吃着烫嘴，双手却拿的紧紧的，不太合常理
898708978,ykapp_vfui3t2i,,lv30,0, , ,iPad客户端,脑子都没有
898706761,,,lv24,0,1, ,Android客户端,"<a href=""http:\/\/comments.youku.com\/star_page\/uid_UODg0MTY=.html"" target=""_blank"">杨紫"
898706665,孙云飞V,,lv30,0,1, ,Android客户端,"<img src=""http:\/\/static.youku.com\/v1.0.157\/index\/img\/smiley\/Qoo7.gif"" alt=""稀饭"" title=""稀饭"" \/>喜欢关关，小清新"
898697818,腾讯用户1461811841297633,,lv3,0,2, ,优酷PC客户端,原来邱莹莹是
898695345,微信用户1461996819298116,,lv8,0,3, ,iPhone客户端,这广告也太多了吧
898694784,愢竒蓶,,lv20,0,9,1,Android客户端,赞同，而且声音也不好听
898688665,土豆用户_831982872,,lv7,1,141, ,iPhone客户端,曲潇筱做法见仁见智，她出于好意测试完全没问题，请把渣渣虐成灰！😊
898686167,ysh萌,,lv14,0,3, ,Android客户端,有插广告。能让人好好看波。
898684884,foodishzhi,,lv10,0,10, ,iPad客户端,为什么没有人想到过：就算曲小小变相以验证自身魅力的方式美其名曰验证渣男，手段很不招喜，可是在此之前她不可能有那个男人的手机号，所以为什么邱莹莹那么蠢，似乎也没人这么帮她分析过？
898679069,那些年31289565,,lv3,0,2, ,iPad客户端,。
898678991,那些年31289565,,lv3,0,1, ,iPad客户端,。
898678691,ysh萌,,lv14,1,12, ,Android客户端,唯一不满的就是广告的长短。实在是太长了。一开始长就算了，中间还插广告。
898678595,那些年31289565,,lv3,0,1, ,iPad客户端,嗯
898678108,YuenYuenYuenYuen,,lv32,1,1, ,iPad客户端,"<a href=""http:\/\/comments.youku.com\/star_page\/uid_UODg0MTY=.html"" target=""_blank"">杨紫"
898678041,那些年31289565,,lv3,0, , ,iPad客户端,就是
898677878,那些年31289565,,lv3,0,1, ,iPad客户端,对
898674216,1203495738,,lv11,0,2,1,Android客户端,虽然说邱莹莹有点那啥，但是曲筱绡这么做很过分，帮邱莹莹认识渣男有很多方式，而曲筱绡选择的这种方法无非是打着帮助别人的幌子测试自己的魅力罢了，说句不好听的，就是伪善。照她这个逻辑，天下的小三儿都是有功之人咯？
898673992,lulier喜碧夫人,,lv31,1,5, ,优酷iku,不明白为神魔有旁白，一个电视剧要是好，为神魔要用旁白，用演员表现出来就好了
898670290,开在迷彩上的格桑花92490511,,lv4,0,5, ,iPhone客户端,这种女生现实生活中也有，我闺蜜之前就是这么，谈恋爱的时候身边的朋友说什么她都听不进去。
898669883,shimianlei,,lv33,0, , ,Android客户端,"<img src=""http:\/\/static.youku.com\/v1.0.157\/index\/img\/smiley\/Yo17.gif"" alt=""赞"" title=""赞"" \/>"
898669540,1203495738,,lv11,0,1, ,Android客户端,邱莹莹和曲筱绡根本不是一个段位的
898667673,︷.゛噓.低調B6920,,lv24,1, , ,Android客户端,好
898666781,風雨糖,,lv14,0,3, ,Android客户端,谁年轻时候没爱过几个人渣，正常
898666438,Elizabeth3091726,,lv37,1,1, ,优酷iku,邱莹莹怎么像个结巴一样
898664981,4eveReMe,,lv32,0,6, ,iPhone客户端,旁白真没意思啊。。。
898657914,︷.゛噓.低調B6920,,lv24,0, , ,Android客户端,变
898653761,汞雪51565180,,lv11,0,2, ,优酷PC客户端,旁白真心败笔
898653307,汞雪51565180,,lv11,1,2, ,优酷PC客户端,正因为这样才会高傲些吧
898651701,小小兔Ayu,,lv41,0,2, ,iPad客户端,邱莹莹和渣男白就是一个迷途羔羊，一个老奸巨猾的狼，说什么都信，真白痴啊
898650727,,,lv19,0,2, ,Android客户端,讨厌邱莹莹
898650583,,,lv19,0,3, ,Android客户端,白主管好丑，渣男猥琐男一个
898650177,,,lv33,0,1, ,优酷iku,看得我尴尬症都犯了
898649644,雪瑾沁梦,,lv10,0,1, ,优酷iku,邱莹莹很讨厌的感觉 太假了
898649090,himiko-勋,,lv27,1,2, ,优酷PC客户端,不喜欢剧里面插进去的声音
898646243,昭君澜,,lv18,0,1, ,优酷PC客户端,没想到真的还有为情节上纲上线的啊，呵呵
898644968,小小兔Ayu,,lv41,2,1, ,iPad客户端,哎呦喂，
898640038,盛者天下67532348,,lv7,0,1, ,优酷iku,very much
898638692,,,lv18,0,1, ,优酷iku,真的不错
898635648,,,lv6,0,1, ,Android客户端,广告好烦嘤嘤嘤
898626835,程程17810718,,lv10,2,3, ,优酷,安迪85年的？还比樊胜美大，那樊胜美是2005年本科毕业的？也就是说她不到20岁就本科毕业了？
898625272,土豆用户_711591383,,lv3,0,6, ,Android客户端,感觉邱莹莹真的好恶心啊，但我不是说
898623326,凤求凰91272885,,lv6,0,1, ,优酷,"<a href=""http:\/\/comments.youku.com\/star_page\/uid_UODg0MTY=.html"" target=""_blank"">杨紫"
898623142,,,lv26,0,2, ,Android客户端,从头到尾都是广告
898619142,腾讯用户146198749764926,,lv2,0,1, ,优酷,"<a href=""http:\/\/comments.youku.com\/star_page\/uid_UODg0MTY=.html"" target=""_blank"">杨紫"
898616015,土豆用户_794978145,,lv2,0,1, ,优酷,上个厕所补个妆广告还在继续广告给力啊
898615753,腾讯用户146198673581159,,lv6,0, , ,iPad客户端,🐘🐘 I Love you
898615702,ykapp_qb5hkz5i,,lv18,0, , ,优酷iku,你妈的，最大的败笔就是背景的那个杀嘿嘿的配音知道吗
898613818,优酷手机用户_iUys5lhf,,lv6,0, , ,iPhone客户端,渣男白
898611455,优酷手机用户_ssqdL0KD,,lv8,0,8, ,优酷iku,好怀念当年为了不看电视上的广告而在网上看视频的感觉！
898606512,증정,,lv14,0, , ,iPhone客户端,好老
898603799,你惯的啊i91636298,,lv15,0, , ,优酷iku,画风不对
898602933,蜗牛狂奔73460784,,lv17,0, , ,Android客户端,大爱宇文念
898602770,神马81580698,,lv4,0, , ,优酷PC客户端,真的
898602707,神马81580698,,lv4,0, , ,优酷PC客户端,用客户端看没广告
898600575,史强jing,,lv27,1, , ,优酷iku,三个女人一台戏，这有五个。
898598393,微信用户1461984298532311,,lv3,1, , ,iPhone客户端,"<a href=""http:\/\/comments.youku.com\/star_page\/uid_UNjY2OTI=.html"" target=""_blank"">蒋欣"
898597224,花衬衫43382285,,lv7,0,3, ,iPad客户端,讨厌小邱
898596894,jskhfskf,,lv33,0,7, ,优酷,"<a href=""http:\/\/comments.youku.com\/star_page\/uid_UODg0MTY=.html"" target=""_blank"">杨紫"
898596763,土豆用户_378410611,,lv13,0, , ,优酷,那就是她太幼稚，你自己的好意想想别人为什么没接受，就全都是别人的错吗？你有没有考虑自己的方式问题。
898593255,时过境迁05080388,,lv22,1, , ,Android客户端,"<a href=""http:\/\/comments.youku.com\/star_page\/uid_UNjc2NzY=.html"" target=""_blank"">刘涛"
898591865,腾讯用户1461973583245529,,lv2,0, , ,Android客户端,一节电视三个广告，三四分钟得到无聊广告
898589521,向城念人丶,,lv31,0, , ,优酷iku,看个视频 客户端崩溃几次
898583840,henwenroude,,lv43,0, , ,Android客户端,我发现用手机看广告时间要
898583078,土豆用户_739689189,,lv2,0, , ,Android客户端,好看！
898581008,,,lv47,1, , ,iPad客户端,奇点老了 无法接受和涛涛一起
898576513,,,lv47,0, , ,iPad客户端,约个饭那么麻烦 简直了 我们不配谈恋爱
898575985,alyna,,lv27,0, , ,优酷PC客户端,旁白有点怪怪的
898568980,土豆用户_411625767,,lv4,0, , ,Android客户端,"<a title=""点击从此时间点开始播放"" alt=""点击从此时间点开始播放"" href=""javascript:PlayerSeekMin('2','00');window.scroll(0,0)"">2分钟"
898561810,钱钱31937539,,lv28,0, , ,iPhone客户端,挺好看的剧
898560241,几间景,,lv7,0, , ,iPhone客户端,对恩 那时候还在吃饭
898559470,几间景,,lv7,1, , ,iPhone客户端,白主管是不是贾青演的八仙过海的龙太子啊
898550495,_91578486,,lv10,2, , ,iPhone客户端,很多人都在为邱莹莹这个角色辩护，但是事实就是，她双商低，如果不改变，注定在这个大城市难以生存。而像我这样讨厌她的人，也不一定是像她。现在像这个角色一样的人，我像也不会多了。
898550121,,,lv53,0, , ,iPad客户端,同意
898549468,,,lv53,0, , ,iPad客户端,华妃有点胖，不错
898535765,905067607,,lv17,0, , ,iPad客户端,不喜欢邱莹莹
898535456,,,lv46,0, , ,优酷,智商捉急的女生，长得再好也受不了
898534057,oo0哘影箛單o,,lv26,0, , ,Android客户端,骂我华妃娘娘的是找死么
898531712,,,lv46,0, , ,优酷,感觉华妃长得一般，
898516672,Oceanus60838939,,lv15,0, , ,iPhone客户端,看了这一集，对
898508657,,,lv17,0, , ,iPad客户端,不要走决战到天亮
898506994,,,lv51,0, , ,iPhone客户端,潜伏里面的李队长....
898505524,,,lv17,0, , ,iPad客户端,生而卑微
898505203,我叫Tina,,lv16,0, , ,Android客户端,这个白主管好猥琐，傻女孩儿很多吖
898503145,,,lv29,1, , ,iPad客户端,你好厉害，人家跟樊吃饭，怎么跟安迪发短信呢
898502240,一梦回笑是惆怅,,lv20,0, , ,iPhone客户端,怎么一集看一会又是广告。看一会又有
898501502,我叫Tina,,lv16,0, , ,Android客户端,我觉得邱莹莹很可爱吖，只是没那么圆滑而已。
898499717,,,lv91,0, , ,优酷,邱莹莹是不是傻？这是傻啊！！！！恋爱的女人是傻子在她身上映射出来了
898488573,meigui5683,,lv9,0, , ,优酷,残缺家庭，大叔控
898488450,meigui5683,,lv9,0, , ,优酷,..
898487415,闲人笑笑,,lv43,0, , ,优酷PC客户端,同意
898482597,xzlbobaaa,,lv12,1, , ,iPhone客户端,"<a href=""http:\/\/comments.youku.com\/star_page\/uid_UNjY2OTI=.html"" target=""_blank"">蒋欣"
898482512,舞梦44737331,,lv4,0,3, ,优酷,广告语。。。多多的广告语。。。这广告打的商家应该给120个赞。。。
898479894,R21741985,,lv13,0,1, ,iPhone客户端,"<a href=""http:\/\/comments.youku.com\/star_page\/uid_UNjY2OTI=.html"" target=""_blank"">蒋欣"
898475596,夜色无边30704843,,lv16,0,1, ,Android客户端,挺有意思的，我很挑的，广告太多了
898475203,孤独者的渴望,,lv22,0, , ,Android客户端,。。。
898471520,ykapp_uquxtuxj,,lv15,1,1, ,优酷iku,女的喝红酒，男的喝果汁
898469384,小宇宙53852210,,lv12,0,5, ,Android客户端,出现的这几个男的没有几个好的，除了勒东
898461956,,,lv26,0, , ,iPad客户端,已转发评论
898458172,想你001つ,,lv5,0,2, ,优酷iku,我身边就有一朋友跟邱莹莹差不多，恋爱时智商捉急
898453191,腾讯用户1461311427975448,,lv5,1,33, ,iPhone客户端,你看樊姐见到王柏川就把持不住自己了，说别人时一套套的，所以啊，道理都是对别人讲的，用在自己身上就失效了
898453008,,,lv13,0,5, ,iPhone客户端,王柏川应该就是那个奇点，想请安迪吃饭那个
898449845,夏洛25335187,,lv15,0,1, ,Android客户端,以为奇点是
898447473,KAYSteven,,lv31,0,2, ,优酷iku,这演员叫什么小雪的，比我大两天...
898445954,ykapp_o0lgio7l,,lv16,0,1, ,iPhone客户端,我的是120
898436801,G-dragon的梦想,,lv30,0, , ,iPhone客户端,心疼我东哥啊！
898436065,L95345512,,lv8,0,1, ,Android客户端,"<a class=""lxy3"" href=""http:\/\/i.youku.com\/i\/name_%E8%85%BE%E8%AE%AF%E7%94%A8%E6%88%B71461940992656903"" target=""_blank"" >@腾讯用户1461940992656903"
898435721,此岸彼岸93342915,,lv3,0,2, ,Android客户端,广告！受不鸟！！！
898429904,IntheShadowofLove,,lv5,0,2, ,Android客户端,广告太多了吧！！！！
898425563,mianimia,,lv14,0,3, ,iPad客户端,他犯贱我乐意，你管得着吗？哈哈哈哈
898421382,土豆用户_378410611,,lv13,1,1, ,优酷,海龟这事曲也说了就是去勾搭帅哥和去玩的，英文都说不顺，在逗我呢，她至少要提醒一下女朋友！这是一个基本的礼仪和教养，她又不是纯种外国人，在这里装什么大尾巴狼，而且，外国人就一定做这种事吗？就算是外国人做这种事的也是少数好吧，你就算是为别人好，也要讲究方法
898417683,土豆用户_761836602,,lv3,0, , ,优酷,打完
898415877,25K纯钛合金眼,,lv21,1,1, ,优酷,根据我观看到第5级的推测 新出现的 王柏川极有可能就是那个奇点
898414091,RunningBeef,,lv16,0,1, ,iPad客户端,这蚯蚓真是太假了
898412071,,,lv60,0, , ,Android客户端,每一个女孩都有为爱情这么盲目的时候
898410625,微笑的太阳_81195591,,lv3,1,1, ,Android Pad客户端,人家靠的是演技
898410280,Aermon22094864,,lv8,0, , ,优酷PC客户端,这邱莹莹我也是醉了，一点吃的就被收买了
898410232,腾讯用户1461940459672217,,lv2,0,1, ,优酷,"<img src=""http:\/\/static.youku.com\/v1.0.157\/index\/img\/emotion\/jixian\/shuaku.gif"" alt=""耍酷"" title=""耍酷"" \/>"
898410036,腾讯用户1461940459672217,,lv2,0, , ,优酷,太假了 不是说第一次来上海嘛 这王柏川开的车咋是上海牌照？ 这么好抢嘛？
898405023,,,lv15,0, , ,iPhone客户端,不喜欢魏渭，总觉得好猥琐！
898404570,ykapp_9nka3rls,,lv32,0, , ,优酷iku,已转发评论
898402988,ykapp_t9o5xfq3,,lv7,0, , ,iPhone客户端,这个旁白毁一部剧
898399637,我会发光i59545021,,lv27,0,1, ,优酷iku,想成为安迪这样的人
898397615,nn1280598465662724,,lv6,0, , ,iPhone客户端,"<a title=""点击从此时间点开始播放"" alt=""点击从此时间点开始播放"" href=""javascript:PlayerSeekMin('12','7');window.scroll(0,0)"">12分7秒"
898394400,Roy36225673,,lv44,0, , ,Android客户端,有了旁白感觉把观众当成了幼儿园的小孩似的，不想看了。
898392112,未来与你18887493,,lv14,0,7, ,Android客户端,希望樊胜美会和老谭在一起，然后安迪和奇点在一起
898390818,腾讯用户1461938147564497,,lv1,1,8, ,优酷PC客户端,实在不怎么理解邱莹莹。。。这智商真让人捉急额。。。
898389193,ykapp_vkll9s90,,lv28,0,5, ,iPad客户端,而且整容了 难看
898389188,,,lv13,7,459,3,Android客户端,我把不喜欢邱莹莹的都赞了一遍
898385615,风采19661835,,lv14,0,1, ,优酷iku,小关挺不错的
898384689,,,lv36,3,54, ,iPhone客户端,邱莹莹是曾经的我们，一个为了爱情盲目的相信那个人，别人的忠言过滤的听，各种傻，单纯，从过去走过的人，如果不喜欢她，只是不喜欢曾经的我们，希望我们都能成长。
898383324,破碎的时光60737638,,lv10,0,20, ,优酷iku,"卧槽了,这邱莹莹..看得我都想弃剧了"
898382051,,,lv17,0, , ,iPhone客户端,早就想说了…
898379738,优酷手机用户_mgQ3kLa3,,lv8,0,13, ,iPhone客户端,还是
898379720,905067607,,lv17,0,5, ,iPad客户端,广告太多了！😱
898376011,,,lv12,0, , ,优酷iku,真搞笑，其实也很现实。。。
898375745,土豆用户_767094394,,lv6,0,6, ,Android客户端,"<a href=""http:\/\/comments.youku.com\/star_page\/uid_UODg0MTY=.html"" target=""_blank"">杨紫"
898373976,腾讯用户1461397011160536,,lv3,3,35, ,iPhone客户端,"<a href=""http:\/\/comments.youku.com\/star_page\/uid_UODg0MTY=.html"" target=""_blank"">杨紫"
898373975,破碎的时光60737638,,lv10,0,7, ,优酷iku,邱莹莹太烦人了.......
898369664,快乐清风16561541,,lv26,0,3, ,iPhone客户端,爱安迪爱萧萧爱小蚯蚓爱关关爱樊姐可就是白主管太猥琐了！
898369487,微信用户1461299198405547,,lv5,0,3, ,Android客户端,我去，莹莹这智商真着急
898368700,腾讯用户1461397011160536,,lv3,0, , ,iPhone客户端,华妃娘娘太美啦！
898368382,优酷用户1461300505435939,,lv2,5,46,1,优酷,我们不喜欢小邱不喜欢关关，恰恰是因她们和生活中的我们一样，开心了会笑，累了会闹会哭。而安迪和小曲这样一个智商高一个情商高，又都有钱有个性，这样的人在我生活中很少，我们也都希望自己成为这样的人。2016已过半给自己一个新的开始吧不努力，没人会为你的青春买单！相信自己一次，说不定这一次你就成功了呢人这一辈子不长，凡事不要给自己留下什么遗憾！让我们一起为青春奔跑想拉你一把时请把手递给我卫星九三七三七六九三一。让我们一起逆袭变优秀
898367755,优酷手机用户_4xg6hobv,,lv9,0,18, ,iPhone客户端,不知道为什么，就是不喜欢邱莹莹
898367701,腾讯用户61741499,,lv12,0,1, ,iPhone客户端,这白主管可真够猥琐
898366841,腾讯用户61741499,,lv12,0,3, ,iPhone客户端,羡慕安迪的能力，靠自己的能力过自己想要的生活
