id,user_name,user_privilege,level,reply_count,up_count,down_count,client_type,comment
904677236,优酷用户1463154673613716,,lv2,0, , ,iPhone客户端,胡歌在那里
904635693,知足常乐16517717,,lv18,0, , ,iPhone客户端,小曲挺可爱的
904631534,,,lv37,0,1, ,优酷PC客户端,"<a title=""点击从此时间点开始播放"" alt=""点击从此时间点开始播放"" href=""javascript:PlayerSeekMin('11','52');window.scroll(0,0)"">11分52秒"
904626169,知足常乐16517717,,lv18,0, , ,iPhone客户端,看到
904625338,知足常乐16517717,,lv18,0,1, ,iPhone客户端,"<a href=""http:\/\/comments.youku.com\/star_page\/uid_UNjc2NzY=.html"" target=""_blank"">刘涛"
904614907,,,lv20,0,1, ,优酷,曲筱筱走路好像大闸蟹。
904609131,土豆用户_387182604,,lv13,0, , ,优酷PC客户端,每次看到祖锋 就想到潜伏里的李涯
904608008,骚年丶02226337,,lv26,1,1, ,优酷iku,邱莹莹真是个二愣子啊。。。曲萧筱给白主管塞纸条但没有他电话号码啊。。。怎么打电话 啊。。。
904605600,骚年丶02226337,,lv26,0,1, ,优酷iku,邱莹莹真是够了。。。傻白啊。。
904599686,,,lv24,0, , ,优酷,你说我怎么没碰到莹莹这种蠢萌的女孩子呢。。。。。。。。。
904593341,,,lv37,1, , ,优酷PC客户端,猥琐男啥意思 求解
904593042,,,lv37,0,1, ,优酷PC客户端,小白不愧是小白 头发好白 绝对猥琐男
904592451,Baby↑吥漓,,lv21,0, , ,Android客户端,小白，大写的辣鸡!
904590763,灬半夏半暖半倾城87080439,,lv2,0, , ,优酷PC客户端,邱莹莹好傻
904589522,,,lv37,0, , ,优酷PC客户端,会员没广告 丫丫
904589079,,,lv37,0,1, ,优酷PC客户端,曲筱绡是为小邱好 不管出于什么目的 结果都是为了她好 小孩子不懂
904587522,a闹够了就滚90594152,,lv7,0, , ,iPhone客户端,莹莹这态度给我上了一课
904583978,腾讯用户1462630828360638,,lv3,0, , ,优酷PC客户端,jiawoqq321654 98
904583807,腾讯用户1462630828360638,,lv3,0, , ,优酷PC客户端,7777777777777777
904575195,如此安好72826576,,lv13,0,1, ,优酷iku,邱莹莹演的不自然啊 讨厌
904571164,Yoyo41018218,,lv10,0, , ,iPad客户端,好喜欢安迪，又漂亮又厉害
904569482,鹿七30438977,,lv10,0,1, ,优酷PC客户端,不喜欢邱莹莹 咋咋呼呼的
904568832,优酷手机用户_lsY8PlZg,,lv11,0, , ,iPad客户端,挺好看的哦
904567292,土豆用户_811299040,,lv5,1,1, ,Android客户端,关关是我最喜欢的类型，
904565708,三字语,,lv1,0, , ,优酷iku,爱关关
904561207,晨晨麻麻31713001,,lv19,0, , ,Android客户端,小邱有点儿缺心眼儿吧
904560584,,,lv10,0, , ,优酷iku,完全看出来这是
904560161,,,lv10,0, , ,优酷iku,6666
904553403,ykapp_ummayox2,,lv30,0, , ,优酷PC客户端,不喜欢邱莹莹
904524715,LOL娱乐解说小一,,lv21,0, , ,优酷,看完这个，点我看激情与搞笑与一身LOL解说！！！
904522413,花千骨QQQ,,lv18,1,1,1,优酷,讨厌邱莹莹
904515452,微信用户1461045321483662,,lv11,0,1, ,iPhone客户端,谁在广告谁无聊着请
904514373,绝情59682539,,lv10,0, , ,Android客户端,喜欢
904513821,绝情59682539,,lv10,0, , ,Android客户端,呵呵
904512055,,,lv28,0, , ,优酷iku,我的没广告
904489731,好想你00059047,,lv11,0,1, ,Android客户端,我靠这广告也太多了
904474662,天使宝贝93478974,,lv20,1,1, ,iPad客户端,如果广告有弹幕会怎么样
904467801,Reziyeeへ,,lv4,0,1, ,优酷PC客户端,不喜欢白主管
904467471,Reziyeeへ,,lv4,0,1, ,优酷PC客户端,感觉安迪最好
904467223,Reziyeeへ,,lv4,0, ,1,优酷PC客户端,欢乐颂好看吗？
904451222,1987艾森精品男装,,lv7,0,1, ,iPhone客户端,挺好的一部电视剧很喜欢
904443195,jello999,,lv33,0, , ,优酷iku,"lm,;l;,m.;m,,.\/nk.\/mjhn .,bnm, 14, } P8?O{&#039;]bh\uo];&#039;8\/[ nm;,lftg 42 iyo\ 41411254444444"
904433204,riin熙,,lv31,0, , ,优酷PC客户端,魏大叔
904429649,一手方一手圆56588764,,lv20,0, , ,优酷PC客户端,优酷没有广告
904429475,永恒di青春,,lv21,0, , ,优酷PC客户端,真的看不懂。
904427819,我不吃watermelon,,lv32,0,1, ,优酷iku,真的是太太太讨厌邱莹莹了
904425113,网络白狐,,lv18,0, ,1,Android客户端,真心不喜欢
904424407,小美女0118,,lv24,0,1, ,优酷iku,看着小邱像个脑残！
904413524,二两牛肉丶一壶流年,,lv7,0, , ,优酷PC客户端,前方高能
904411370,形同陌路65558342,,lv6,0,2, ,Android客户端,广告那么长那么多
904408678,,,lv27,0,4, ,Android客户端,讨厌丘莹莹这个角色，演技差，又不让人喜欢，个人意见，不喜勿喷
904407483,腾讯用户1463123764807577,,lv2,0,1, ,Android客户端,广告时间太长
904399638,o92282435,,lv10,0,2, ,iPhone客户端,看邱莹莹那个脑残样就想快进
904388414,Skyao98107637,,lv12,0,1, ,Android客户端,没看完一集就出一次广告 广告无处不在 开头广告时间就那么长了
904379455,鱼迷不是玉米,,lv11,0,1, ,Android客户端,毫无准备的又进入了广告区😂
904378898,,,lv40,0,1, ,优酷iku,我觉得她挺好的
904377405,,,lv49,0,1, ,优酷iku,唉。。。。蚯蚓这姑娘，傻。。。
904365496,腾讯用户7764301522038119,,lv6,0, , ,iPhone客户端,我也觉得
904361676,星芯馨,,lv29,0, , ,iPhone客户端,老子看了2次广告怎么屌啊
904342897,耗子精婷婷,,lv34,0,1, ,优酷PC客户端,细节不好 奇点站起来的时候西服下摆都是皱的
904337443,下一个自己21348339,,lv27,0, , ,Android客户端,楼下人家是演戏而已 你们哪里那多话
904337233,月亮27304470,,lv11,0, , ,Android客户端,太不要脸了，广告越来越长
904326277,耗子精婷婷,,lv34,0, , ,优酷PC客户端,如果邱莹莹是颖宝儿演得就好了
904310911,ourloveyao,,lv34,0, , ,iPhone客户端,下巴肯定动了
904310257,じ本宫没空ぴ23753694,,lv14,0,1, ,iPad客户端,不是
904300970,DS不陨的羁绊,,lv6,0,4, ,优酷iku,大爱小关
904226458,尐爺賊緢,,lv6,0,4, ,Android客户端,"<a href=""http:\/\/comments.youku.com\/star_page\/uid_UODg0MTY=.html"" target=""_blank"">杨紫"
904217879,,,lv19,0,2, ,优酷,"<img src=""http:\/\/static.youku.com\/v1.0.157\/index\/img\/vip_emotion\/baoman\/xiaocry.gif"" alt=""暴走-笑cry"" title=""暴走-笑cry"" \/>"
904197698,微信用户1461191805303375,,lv10,0,1, ,Android客户端,太好骗了
904193647,微信用户1461191805303375,,lv10,0,2, ,Android客户端,樊姐的老同学不简单
904193391,微信用户1461191805303375,,lv10,0,4, ,Android客户端,"<a href=""http:\/\/comments.youku.com\/star_page\/uid_UODg0MTY=.html"" target=""_blank"">杨紫"
904185021,穆特尔,,lv9,0,1, ,Android客户端,特别期待萧景琰赶紧出来震楼，否则没劲了
904134253,微信用户1461567780928733,,lv8,0,1, ,iPhone客户端,奇点感觉很绅士
904121520,出肯定,,lv14,0,2, ,Android客户端,那白主管不是演八仙全传里艳彩表哥的那个人吗？
904119901,赞歌1999,,lv22,0,2, ,优酷,男一有点配不上女一号啊，颜值不行啊
904113621,土豆用户_406847840,,lv8,0, , ,Android客户端,好傻，有这样傻得人吗？
904109385,精灵王国的小小公主,,lv19,1, , ,iPhone客户端,看到蚯蚓那个弱智就烦。。
904107504,精灵王国的小小公主,,lv19,1, , ,iPhone客户端,这旁白好讨厌
904106124,时空大人,,lv18,0, , ,优酷PC客户端,其实小曲做的是对的 她以后肯定明白 但当时就不懂 哎
904105732,晓辛hyz,,lv52,0, , ,iPhone客户端,看她们让我想起了《粉红女郎》这部电视剧！
904102049,无论在何时12,,lv28,0, , ,优酷PC客户端,曲筱筱一点都不美好吗，除了家财还有什么，邱莹莹才真正好看可爱，只是不自信，阅历不够，没啥不好的呀；跳出来想这个情节也是想告诫无知女孩别上当，有的男同胞也是有些渣，早分早好
904100634,优酷手机用户_s9v91n4f,,lv9,0, , ,优酷移动播放页,好看
904095033,fuwen8521,,lv35,0, , ,优酷iku,优酷客户端 什么时候有广告了
904092028,微博用户1462544885177801,,lv3,0, , ,iPhone客户端,嗷嗷 怎么下载！广告广告！
904084024,土豆用户_750638769,,lv2,0, , ,优酷PC客户端,PC 端 没广告 大家注意啊
904073609,似梦的年华ヽ69171308,,lv11,0, , ,优酷iku,不错的电视剧 很喜欢
904073279,土豆用户_750638769,,lv2,1, , ,优酷PC客户端,是的 但是你会觉得她整容了ma？？？
904073195,zi_hai,,lv23,0, , ,Android客户端,咦蛮好
904072833,梦醒时分52639343,,lv11,0, , ,Android客户端,邱莹莹是家有儿女那个
904071194,土豆用户_750638769,,lv2,0, , ,优酷PC客户端,我理解樊，但我不回去做，重来没有。虚假的自己，赢不回来真实。当然，我这种人朋友少 很正常吧。
904069826,泰拉黑,,lv18,0, , ,iPhone客户端,太好了，我才45公斤哦
904069599,土豆用户_750638769,,lv2,0, , ,优酷PC客户端,爱情是盲目的 ，不知道有多少人 相信这爱情 怀疑这爱情
904068632,土豆用户_750638769,,lv2,0, , ,优酷PC客户端,白主管 这 演的 而且 太做作 单纯de为了这种桥段 来演 我不是觉得很精彩 也许是演员功力不够吧
904068492,,,lv6,0, , ,优酷iku,竟然没有人吐槽奇点的手看起来又白又嫩比小姑娘还好，但是脸··············反差太大，我想静静【捂脸】
904067944,樱花落浅暮雪12279343,,lv5,0, , ,iPhone客户端,喜欢
904067037,Kiki46474025,,lv18,0, , ,iPhone客户端,莹莹演得没有技术含量！面部表情浮夸，呕心死了
904066905,女孩路过,,lv29,0, , ,iPad客户端,机智的二楼
904065098,支付宝用户146103032542433,,lv6,0, , ,iPhone客户端,我绝得奇点有可能意识到安迪是女子
904062764,多多宝贝54128565,,lv14,0, , ,iPad客户端,已转发评论
904062298,噗嗵噗嗵91534224,,lv14,0, , ,Android客户端,"<a href=""http:\/\/comments.youku.com\/star_page\/uid_UNjY2OTI=.html"" target=""_blank"">蒋欣"
904057048,天蓝色的彼岸48731266,,lv5,1, , ,Android客户端,看到不赞的话，明天长10斤肉哦
904054912,其实超人也会流眼泪,,lv27,0, , ,iPad客户端,我都是缓存了然后把无线关了……
904048815,不想写不行,,lv28,0, , ,优酷PC客户端,这老谭是不是喜欢安迪啊
904045461,慧眼观剧,,lv64,0, , ,优酷iku,如果奇点见到安迪的感觉是有点惊讶的话，那安迪见到奇点应该是失望才对吧？不明白为什么不能找一个至少在外形上配的上安迪的人来演这个角色。
904044616,王小婧稳稳的幸福,,lv11,0, , ,iPhone客户端,已经缓存了，还有广告，而且是插播三段。我也是醉了…
904018620,手机用户_394139342,,lv29,0,1, ,Android Pad客户端,不错
904013824,,,lv38,0,1, ,iPhone客户端,为什么放不出来
904010071,非非衣衣1,,lv18,1,4, ,iPad客户端,il
904008624,优酷用户1462444581546684,,lv10,0,1, ,iPhone客户端,怎么看不了
904002199,,,lv21,0,2, ,优酷,小蚯蚓着孩子太傻了
904000674,腾讯用户1462814642742673,,lv9,0,1, ,iPhone客户端,小说叫什么名字啊
903999523,慧眼观剧,,lv64,0,2, ,优酷iku,喜欢关关，乖巧可爱、热心助人、善解人意。
903997473,土豆用户_421656716,,lv3,0,1, ,优酷,感情这 新版红楼梦也用上了 
903996658,知了静默,,lv25,1,5, ,Android客户端,旁白老让我出戏
903973970,世界未末日77698687,,lv3,0,1, ,iPhone客户端,其实你们也要想，广告也是给他们一口饭吃，理解一下
903973429,混世邪君9,,lv20,0,2, ,优酷,怎么觉得他好斯文
903973154,最美的时光52499522,,lv9,0,1, ,iPad客户端,这只是我们不愿承认的现实
903971832,最美的时光52499522,,lv9,0,2, ,iPad客户端,这世上有太多邱莹莹，身世一般才貌一般，却期盼着有人会看到她的“不一般”，
903943258,土豆用户_505841747,,lv8,0,1, ,Android客户端,好看，很真实
903932563,黄色油条金灿灿,,lv12,0,2, ,iPhone客户端,看到所有人都吐槽广告多我也就放学了
903930796,,,lv34,0,1, ,优酷,"<a href=""http:\/\/comments.youku.com\/star_page\/uid_UNjc2NzY=.html"" target=""_blank"">刘涛"
903929556,,,lv34,0,6, ,优酷,旁白的加入显得我们看官智商有点低，都不用动脑子了。我去买包瓜子~
903921585,cfs911,,lv37,0,2, ,优酷,好讨厌这旁白
903908395,土豆用户_435391444,,lv11,0,1, ,优酷iku,一个太物资，一个太无知，一个太无敌，关关很努力邻家小妹，我就喜欢这个。
903904451,十指相扣E8C8C,,lv17,0,1, ,优酷,怎么觉得就是那么作，真受不了
903899126,镇爱菲,,lv7,1,4, ,Android客户端,我要疯了，这么多广告，必须滴卸载
903894497,_90018516,,lv9,0,2, ,优酷PC客户端,太坑人了 患有 时间限制
903894319,_90018516,,lv9,0,3, ,优酷PC客户端,广告太多 卧槽
903879497,Insist53938979,,lv9,0,5, ,iPhone客户端,怎么那么广告呀。
903866719,优酷手机用户_hybkk48q,,lv25,0,1, ,iPad客户端,已转发评论
903847540,伯轩麻麻,,lv11,0,1, ,Android客户端,广告太吓人了，看着正带劲，广告就来了
903844295,Xc08315948,,lv19,0,3, ,iPhone客户端,邱莹莹就是弱智
903823889,土豆用户_403973604,,lv12,0,2, ,优酷,真是没看几分钟，就一大堆广告。
903807896,Cherrywwh,,lv22,0,3, ,iPhone客户端,我怎么觉得
903802997,花与Alice24705258,,lv9,0,5, ,优酷,"<a href=""http:\/\/comments.youku.com\/star_page\/uid_UODg0MTY=.html"" target=""_blank"">杨紫"
903797133,望己成龙,,lv26,1,1, ,优酷,全屏怎么发弹幕
903796523,褶达欧练,,lv13,0, , ,Android客户端,我知道电视剧别人想说一题了，心情看懂心理学
903789783,A东海75489987,,lv6,0, , ,Android客户端,已转发评论
903789723,A东海75489987,,lv6,0, , ,Android客户端,还有我
903788397,腾讯用户1462717538750104,,lv8,2, , ,Android客户端,不会是只有我一个看着看着自动跳回前一集的吧
903778479,王林林是木头的林,,lv12,0, , ,iPhone客户端,欢迎关注公众号qqydian，红包信息
903773212,蛋蛋1321,,lv32,0,1, ,优酷iku,心疼我滨。。。。
903771614,game_z65n6k,,lv13,0, , ,iPad客户端,已转发评论
903741387,ykapp_8m5f6p12,,lv22,0, , ,优酷,能上评论
903739988,微信用户1461191805303375,,lv10,0, , ,Android客户端,娘娘好胖，肩宽臀大
903739831,你一口L我一口,,lv38,0,1, ,优酷iku,"<a href=""http:\/\/comments.youku.com\/star_page\/uid_UODg0MTY=.html"" target=""_blank"">杨紫"
903739457,-情请情情,,lv5,0,2, ,优酷,我是过来看广告来了，
903722875,______信念34623555,,lv12,0, , ,Android客户端,哪个是
903722667,,,lv9,0,4, ,iPhone客户端,"<a href=""http:\/\/comments.youku.com\/star_page\/uid_UODg0MTY=.html"" target=""_blank"">杨紫"
903701765,还在70226491,,lv20,0, , ,iPad客户端,我的
903700539,支付宝用户65177133,,lv8,0, , ,iPhone客户端,广告简直醉了
903690185,腾讯用户1462899239252446,,lv1,0, , ,iPhone客户端,喜欢美衣ma960729
903689102,畅想思维,,lv52,0, , ,优酷,邱莹莹演的真好。
903683907,腾讯用户1462237861418481,,lv2,0, , ,优酷iku,曲莹莹这女孩子太单纯了
903674234,优酷用户1461300505435939,,lv2,0,2, ,优酷,"<a href=""http:\/\/comments.youku.com\/star_page\/uid_UODg0MTY=.html"" target=""_blank"">杨紫"
903673928,微信用户1462978479647221,,lv8,0, , ,iPhone客户端,真心觉得
903673628,腾讯用户146262461396269,,lv3,0, , ,iPhone客户端,哇噢！我超喜欢小邱，和我的性格很像，她们五个的关系和我们闺蜜之间一样！
903670614,美曦17578371,,lv23,0,2, ,Android客户端,恋爱中的女人真的是智商为零啊！😁
903667514,晴空的云52287671,,lv23,0, , ,Android Pad客户端,好长的广告
903667061,洛书57262251,,lv26,0, , ,优酷PC客户端,我觉得刚入社会的女孩子确实不懂这些
903665739,微信用户1462145132850279,,lv5,0, , ,iPhone客户端,已转发评论
903665441,创业中国季,,lv16,0, , ,iPhone客户端,一般般
903663353,,,lv24,0, , ,优酷,这不是李涯吗
903658298,宇宙无敌帅锅,,lv10,0, , ,iPad客户端,本色出演
903653988,备忘录20471110,,lv5,0, ,1,Android客户端,邱莹莹是猪吗？!智商太“高”了!
903653683,看看热闹呗，呸,,lv14,0, , ,iPhone客户端,这电视剧从一开始就蛮伤人的，建筑装饰服装车所有物质都散发着鄙视穷人的气息。
903652201,aini13992,,lv36,0, , ,优酷iku,和爱情公寓比差远了！！！
903651687,看看热闹呗，呸,,lv14,0,1, ,iPhone客户端,这个叫都市真人爱情童话梦幻剧。
903651104,只想更疼迩17039965,,lv13,0, , ,优酷,我一直在找琅琊榜的熟面孔，嘎嘎
903638316,放云人,,lv36,1,1, ,优酷PC客户端,两个哥哥这骨头就难吭了
903635104,oO七宗罪Oo,,lv39,0, , ,优酷iku,男人呀 好难~~~
903621041,,,lv27,0, , ,优酷PC客户端,刚工作的大学生 心思单纯 是这样的
903620658,,,lv27,0, , ,优酷PC客户端,爱情只要你陷进去 别人是话都听不进去 除非你经历过
903614999,,,lv27,0, , ,优酷PC客户端,恋爱中的女人真的。。。智商。。
903611621,mellkon,,lv36,0, , ,Android客户端,好烦人的广告
903608704,放云人,,lv36,0, , ,优酷PC客户端,昨天没广告，今天有了
903605042,沉默的表示98359365,,lv25,0, , ,Android客户端,其实原著里 曲有两哥哥
903601609,,,lv28,0, , ,iPhone客户端,怎么感觉
903595377,helokitty82105113,,lv10,0, , ,Android客户端,啦！
903593530,Dj春春,,lv9,0, , ,iPhone客户端,广告多得想卸载……
903584764,手机用户_684816739,,lv6,0,1, ,iPhone客户端,广告你敢再多一点吗
903582800,霞浦泷泽萝拉,,lv7,0,1, ,Android客户端,觉得演的都很真实啊 不要因为一个你不喜欢的角色去诋毁这个演员
903581077,混世邪君9,,lv20,2, , ,优酷PC客户端,看来这集觉得这小白也算不上个渣男呀，，，，，
903577517,Dear晗_Deer晗,,lv21,0, , ,Android客户端,全世界都觉得曲筱筱的做法对作法好，但如果你身边有这样的人，你就不会真么轻易的觉得他好了。而且做曲筱筱这样的人也是要有底气的，做这样的人并不快乐
903575886,混世邪君9,,lv20,0, , ,优酷PC客户端,这网友为了让安迪见面还真费尽心思呀，脸书上高人还真多呀，这招数都想得出来，，，简直让人无语了，，，，
903574567,混世邪君9,,lv20,0,1, ,优酷PC客户端,这小蚯蚓的男友你说他是渣男吧他又不是，一美女偷偷的塞给她电话的纸条，只是让他搬了个家，其他的也没做，算不上曲筱萧抢那小蚯蚓的男友，像
903572361,混世邪君9,,lv20,0, , ,优酷PC客户端,觉得呀，这
903567143,米至尊,,lv15,0, , ,优酷PC客户端,小蚯蚓！！！！！！！！！！！！！
903566922,米至尊,,lv15,0,1, ,优酷PC客户端,小蚯蚓，我受不了你啦，怎么这么傻？！！！
903554475,无敌广_425284862,,lv13,0, , ,优酷PC客户端,不管多么精明的感情专家在自己爱的人面前她的智商都会变的不堪一击。
903542225,优酷用户1462592201536896,,lv10,0,1, ,iPhone客户端,太多广告了……无语了
903528169,微信用户1462760133463137,,lv7,0, , ,iPhone客户端,确实傻
903527060,腾讯用户1462074236157663,,lv2,1,1, ,Android客户端,小蚯蚓太笨到了，猪脑子
903525301,冰心柠檬bibi,,lv15,0,1, ,优酷iku,邱莹莹傻的叫人无语
903524585,微信用户1462760133463137,,lv7,0,1, ,iPhone客户端,哈哈 摆明她不要脸
903520580,mcq19960107,,lv12,0, , ,iPhone客户端,换个人演白主管都行这人什么鬼
903513679,微信用户1462954372965574,,lv3,0,1, ,Android客户端,喜欢
903512909,402599830,,lv53,0, , ,优酷,不喜欢曲筱筱，托马神经病吧，换成别人打着替你测试你男朋友的名号撩你男票你高兴？
903508726,深情是罪54980583,,lv6,0,1, ,优酷iku,就是正义啊
903508298,贾灿宇大笨蛋,,lv26,0,1, ,iPhone客户端,看见邱莹莹恶心
903504242,卿筱宝,,lv38,0,1, ,iPhone客户端,小蚯蚓真的傻的看的人心疼
903498160,优酷用户1462897255688651,,lv7,0, , ,优酷PC客户端,.
903497136,大炜64084492,,lv6,0, , ,Android客户端,会员换个wifi都不能用了吗
903493014,斯彣宅莮,,lv3,0,2, ,优酷,真新不知道看的电视剧还是看的广告 我也是够够的 这么多广告
903487436,微信用户1462946456159288,,lv7,0,3, ,Android客户端,这个奇点如果换个帅点的男演员，应该更有看头吧！
903486016,564894154,,lv31,0, , ,优酷,为啥
903483292,豆芽菜921123,,lv11,0,1, ,Android客户端,不喜欢邱莹莹
903479501,我要丶吃糖,,lv26,1, , ,优酷iku,那个白主管，是不是《八仙全传》里龙女贾青的那花龙哥哥啊，一直觉得好眼熟。
903476662,,,lv29,0,1, ,优酷,"<img src=""http:\/\/static.youku.com\/v1.0.157\/index\/img\/vip_emotion\/wanwan\/dainu.gif"" alt=""呆怒"" title=""呆怒"" \/>"
903474354,优酷手机用户_27hif1vz,,lv11,0,2, ,iPhone客户端,邱莹莹这个角色看着有点让人着急
903471468,Babyking99766749,,lv13,0, , ,iPhone客户端,齐点好丑啊
903464247,小小颖桃,,lv15,0, , ,iPad客户端,"<a title=""点击从此时间点开始播放"" alt=""点击从此时间点开始播放"" href=""javascript:PlayerSeekMin('12','54');window.scroll(0,0)"">12分54秒"
903461413,腾讯用户1462445454776258,,lv3,0,1, ,Android Pad客户端,阿秀
903458610,,,lv13,0,2, ,优酷iku,请说出哪条法律说在中国境内不允许使用facebook？
903452003,四叶草95790163,,lv6,0, , ,iPad客户端,太瘦了，不好看
903451891,路且歌,,lv25,0, , ,优酷PC客户端,我去。。曲筱筱有病吧。。就算白主管再渣你也不能撩自己朋友的男人好吗。。难道打着“替邱莹莹考验她男朋友”的名义撩别人男朋友就是正义了吗？
903449488,旧时明月84747177,,lv16,1,3, ,iPad客户端,"<a class=""lxy3"" href=""http:\/\/i.youku.com\/i\/name_%E5%91%A8%E5%A4%A7%E7%82%AE20979401"" target=""_blank"" >@周大炮20979401"
903449314,旧时明月84747177,,lv16,1,2, ,iPad客户端,你们的广告多少秒
903448135,四叶草95790163,,lv6,0,1, ,iPad客户端,太瘦了
903435922,oolomo,,lv13,0,1, ,iPad客户端,在广告里插播电视剧是不对的，优酷君
903425433,ykapp_885q18ix,,lv20,0, , ,Android客户端,你踏马这样夸自己 要不要脸
903420697,腾讯用户1461460691730331,,lv5,0, , ,Android客户端,奔着小曲来的
903419058,,,lv45,0,1, ,iPad客户端,在中国，用Facebook是不是违法的。安迪在干着违法的事情。
903417716,微信用户1462506703432770,,lv3,0, , ,Android客户端,我就喜欢你很讨厌我而又干不掉的样子
903406879,白开水i22697711,,lv8,0, , ,Android客户端,有没有跟我一样觉得奇点像百度李彦宏？
903402521,幸福的狸花,,lv12,0,2, ,优酷,喜欢曲妖精，安迪的大姐风范，小美的直率
903398340,优酷用户1461929305874681,,lv2,0,1, ,Android客户端,这部剧挺有现实意义的
903371122,周大炮20979401,,lv16,0,2, ,Android客户端,"<a href=""http:\/\/comments.youku.com\/star_page\/uid_UNjc2NzY=.html"" target=""_blank"">刘涛"
903366449,周大炮20979401,,lv16,2,1, ,Android客户端,我太踏马喜欢曲筱绡了，这性格我喜欢，人也漂亮，做事跟我一样嘎巴溜溜脆，敢作敢当。
903363420,周大炮20979401,,lv16,0, , ,Android客户端,白主管好像张赫宣
903361261,支付宝用户33066413,,lv8,0,1, ,iPhone客户端,"<a href=""http:\/\/comments.youku.com\/star_page\/uid_UNjc2NzY=.html"" target=""_blank"">刘涛"
903326495,微信用户1462024567053616,,lv7,0,2, ,Android客户端,邱莹莹这个角色已醉
903317558,_梁秋霞24006532,,lv5,0, , ,iPhone客户端,很多人都像那样试过 往往错过了才能分清人心
903310882,杨林56133446,,lv21,0, , ,Android客户端,最牛广告
903305734,优酷手机用户_k85huvw2,,lv8,0, , ,iPad客户端,最感人的就是优酷的广告
903281183,,,lv20,0,2, ,Android客户端,"<a href=""http:\/\/comments.youku.com\/star_page\/uid_UODg0MTY=.html"" target=""_blank"">杨紫"
903269584,可惜流年03074640,,lv24,0,1, ,优酷iku,今年也刚好毕业，看见他们毕业时穿的学士服，文科的小粉领，感觉良多，未来也会这样和身为同学的她相遇吗
903264073,小谁33179840,,lv8,0, , ,iPhone客户端,"<a href=""http:\/\/comments.youku.com\/star_page\/uid_UNjc2NzY=.html"" target=""_blank"">刘涛"
903258042,没教养De猪,,lv27,0, , ,iPhone客户端,小说 可能是2010年左右出来的 电视剧是2016年 但安迪就得是30岁左右 所以整个时间轴往前推喽
903255570,单身大龄男青年,,lv9,0, , ,优酷,邱莹莹情商是负的
903254833,ztc325,,lv5,0, , ,iPhone客户端,二十多岁女孩应该懂事了好吗，以为十多岁呢？
903254528,ztc325,,lv5,0, , ,iPhone客户端,不喜欢邱莹莹
903249968,沉默的表示98359365,,lv25,0, , ,Android客户端,我最近看电视剧看了两集之后，都会跑去看那个原著，嗯，然后一直发现各种电视剧都一样，原著里面改了蛮多的
903248268,沉默的表示98359365,,lv25,1, , ,Android客户端,原著里都说了安迪有个1983年出生的弟弟，这里，她居然说她自己是1985年。 额…这个……
903244324,微信用户1461073037822309,,lv6,0,2, ,iPhone客户端,我当时也是被这样的渣男骗的，他解释什么我都觉得很有道理，自然就受骗了
903241411,微信用户1461774132113431,,lv4,0, , ,Android客户端,演戏而已，别那么当真，一帮傻子
903240789,我要狠狠的幸福95519657,,lv3,0, , ,Android客户端,好看
903238931,冰倩79260302,,lv3,0, , ,Android客户端,"<a href=""http:\/\/comments.youku.com\/star_page\/uid_UNjY2OTI=.html"" target=""_blank"">蒋欣"
903228347,优酷手机用户_McQc6n7E,,lv12,0, , ,Android客户端,已转发评论
