id,user_name,user_privilege,level,reply_count,up_count,down_count,client_type,comment
907446209,Momo8950,,lv24,0, , ,iPad客户端,已转发评论
907440042,优酷用户1462881119145485,,lv5,0, , ,iPhone客户端,红色911好漂亮，好喜欢
907425237,土豆用户_683911372,,lv10,0, , ,iPhone客户端,喜欢关
907421260,,,lv11,0, , ,Android客户端,真的好想撕
907408830,幻影影刃,,lv13,0, , ,优酷PC客户端,。。
907391758,三生三世51134702,,lv7,0, , ,Android客户端,这广告，总共加起来
907378273,,,lv37,1, , ,iPad客户端,我不是会员么，为什么满屏广告
907357722,锦绣铭心,,lv20,0, , ,iPad客户端,不错的电视剧，有很多共鸣点。期待第二部
907351122,单骑一戟,,lv11,0, , ,优酷,喜欢有旁白！喜欢五个女孩，特别是安迪，樊胜美，曲筱绡。
907336404,米歇尔专业孕妇儿童摄影,,lv10,0, , ,优酷,樊姐 有点拜金哦！ 不太喜欢， 个人觉得 关关 邱邱 更好些。
907335999,小时代62892298,,lv12,0, , ,iPhone客户端,讨厌广告
907327030,_77081968,,lv6,0, , ,优酷,表达的价值观有问题
907325007,,,lv52,0, , ,Android客户端,现实的让人觉得好累，好累。
907314680,,,lv38,0, , ,Android客户端,拍的蛮真实的
907308549,,,lv17,1, , ,iPad客户端,哟，您开的什么车住的是什么小区呢
907291828,优酷用户1463119921690862,,lv4,0, , ,iPad客户端,今天天我要看这
907284001,銨靜の風,,lv4,0, , ,iPad客户端,在上海住个中档小区 开个保时捷911顶配很稀奇吗？这个片子我只能说图样
907278076,淡然的微笑27972554,,lv8,0,1, ,Android客户端,广告太多
907277761,,,lv42,0, , ,Android客户端,最近比较懒惰了，看了一个浑身竟劲儿！加油
907225062,o哦呵o,,lv20,0,1, ,Android客户端,这尼玛广告才多
907202782,天天91006322,,lv27,0,1, ,Android Pad客户端,喜欢安迪
907197436,,,lv5,0,1, ,iPhone客户端,邱莹莹实在太没教养了
907176495,seamse,,lv18,0,1, ,iPhone客户端,特地等到结局看，不用心急火燎的等更新
907172707,露露62696437,,lv8,0,1, ,iPhone客户端,m我就想问销筱能不能好好去走路、不要摆的像鸭子行吗
907130135,受伤的鱼27344330,,lv13,0, , ,Android客户端,看三次后，才明白编剧。
907116545,爸爸卡卡,,lv27,0,1, ,优酷PC客户端,小邱真的很单纯很直率，时间和经历会慢慢抹点她所有的优点，留下的只是世俗的
907106423,腾讯用户1462879065644343,,lv4,0,1, ,Android客户端,六十秒的预告片，要一百六十秒的广告。睡能告诉我这是为什么
907102562,ツ47965897,,lv7,0,1, ,Android客户端,优酷ZTMD坑爹，广告时间加起来都可以绕地球一个亿了
907097576,法号遗梦,,lv41,0, , ,优酷PC客户端,尼玛，以前pc客户端都没有广告的
907095180,支付宝用户37684686,,lv7,0, , ,Android客户端,2
907084237,我硬是醉了,,lv19,0, , ,Android客户端,开个会员就好了
907046031,,,lv38,1, , ,优酷,曲筱筱简直就是个双标绿茶婊，骚浪贱！
907032004,腾讯用户1463394052089989,,lv1,0, , ,优酷PC客户端,666
907021694,BABYSTEP官方,,lv13,0, , ,优酷,好帅的男猪脚！同意的赞我！！！对了，新手爸妈想看育儿节目点我哦！好帅的男猪脚！同意的赞我！！！对了，新手爸妈想看育儿节目点我哦！好帅的男猪脚！同意的赞我！！！对了，新手爸妈想看育儿节目点我哦！好帅的男猪脚！同意的赞我！！！对了，新手爸妈想看育儿节目点我哦！好帅的男猪脚！同意的赞我！！！对了，新手爸妈想看育儿节目点我哦！
907018198,,,lv44,0, , ,iPad客户端,安迪太高冷了！
906972415,天德61471147,,lv5,0, , ,iPhone客户端,樊姐就是贱
906941707,,,lv12,0, , ,iPad客户端,广告太多了
906925420,钟离剑兰,,lv24,1, , ,优酷iku,好几十层你老就慢慢爬吧
906919067,Cathy42298827,,lv7,0, , ,Android客户端,广告太长了
906907855,李佳寒,,lv27,0, , ,优酷PC客户端,我以后一定爬楼梯 啊 太可怕了
906907709,腾讯用户1462679909446820,,lv6,0,1, ,iPhone客户端,尼玛这广告也太长吧。
906897492,LOL娱乐解说小一,,lv21,0, , ,优酷,点我看最新一期搞笑与激情于一身的解说！吃饭时候别看，保证让您笑。如果不笑，只能说明你没听懂。呵呵！我在我家等你们。路过进来喝点茶水。
906849171,少女心作祟50944283,,lv3,0, , ,Android客户端,靠广告都卡
906825275,,,lv11,0, , ,优酷PC客户端,看你们这么多抱怨的 既然追剧 不下载一个客户端呢 无广告啊
906813475,巴黎的静゛,,lv11,0, , ,Android客户端,喜欢邱莹莹单纯可爱比较活泼
906804292,暖暖觅87766970,,lv23,0,1, ,Android客户端,已转发评论
906792421,90后阿鹏,,lv29,0, , ,优酷,演的很现实，中国的电梯简直了，无语啊。难道电梯是纸壳子糊得吗。
906792365,微信用户1463583783045452,,lv4,0, , ,Android客户端,烦死了，老是在广告时间插播电视剧
906791774,陈风力力力,,lv13,0,1, ,iPad客户端,这小区真不砸的什么电梯安迪刚才还很怕一会又恢复记忆了
906790575,90后阿鹏,,lv29,0, , ,优酷,邱莹莹渣渣呼呼，能请神不能安神。
906789317,腾讯用户1462213116450380,,lv6,0, , ,Android客户端,要是
906787000,陈风力力力,,lv13,1, , ,iPad客户端,白主管都没有会计证还能当主管什么公司啊
906773581,绿色暖风,,lv18,1, , ,优酷,如此2B的女的就活该被骗。
906764690,学不会淑女范66359282,,lv4,0, , ,iPhone客户端,广告竟然一百多秒
906761320,傀儡娃娃锝眼泪,,lv2,0, , ,Android客户端,广告君在哪？
906760771,土豆用户_728621787,,lv20,0, , ,优酷,什么样的公司会找个没有会计证的年轻人当财务主管，而且这人直接去上注册会计师的培训班。。
906760385,心灵鸡汤_,,lv21,0, , ,Android客户端,我都喜欢5个女演员
906756511,心灵鸡汤_,,lv21,1, , ,Android客户端,为什么那么多广告
906755460,微信用户1463577621257373,,lv9,1, , ,iPhone客户端,"<a href=""http:\/\/comments.youku.com\/star_page\/uid_UODc2Mjg=.html"" target=""_blank"">王子文"
906746843,,,lv17,0, , ,iPhone客户端,接口
906740219,网毁少年梦92485906,,lv27,0,2, ,Android客户端,看到这么多广告直接弃剧
906734360,柠36764699,,lv11,0, , ,iPad客户端,喜欢关关！
906726768,,,lv10,0, , ,iPhone客户端,"<img src=""http:\/\/static.youku.com\/v1.0.157\/index\/img\/smiley\/Yo17.gif"" alt=""赞"" title=""赞"" \/>"
906718899,丹70879970,,lv23,0, , ,iPad客户端,电梯那段邱真的好烦
906718649,麦春江,,lv44,0, , ,优酷iku,自己吓自己
906718160,麦春江,,lv44,0, , ,优酷iku,现实哪是这样
906708542,modelmy,,lv31,0, , ,优酷PC客户端,这一兴奋就没脑子了，果然够天真
906706156,modelmy,,lv31,0, , ,优酷PC客户端,剩女的心酸
906685949,我在时光深处等你08773326,,lv19,0, , ,iPhone客户端,逗逼逗逼逗逼逗逼
906678424,,,lv26,0, , ,iPhone客户端,喜欢
906675398,,,lv26,0, , ,iPhone客户端,那个曲的女人走路扭得圆呢
906668012,永恒的时间60081721,,lv19,0, , ,优酷iku,一个电梯 耽误一集 真是无聊
906632811,优酷用户1463551700888327,,lv1,0, , ,iPad客户端,安迪的保时捷911帅呆了！
906632500,优酷用户1463551700888327,,lv1,0, , ,iPad客户端,安迪的保时捷911，帅呆了！
906631900,优酷用户1463551700888327,,lv1,0, , ,iPad客户端,怎么会有那么一点点的小却点赞
906630961,,,lv37,0,1, ,优酷,看着看着屏幕中间出来个广告是什么意思 ？
906624782,勿忘心安89801963,,lv7,2, , ,Android客户端,有没有人觉得关关仰头坐下的一瞬间超像刘亦菲
906616984,,,lv26,0, , ,iPad客户端,小丘属于刚毕业那种无大脑的女生吧。刚毕业比这个强点 我感觉。
906607022,永ov恒,,lv55,0, , ,Android客户端,坐一下
906589785,jpeiyang,,lv28,0,1, ,iPad客户端,优酷两分钟的广告 相当于浪费无数人的生命 作孽！！！！
906561075,支付宝用户77867141,,lv10,0, , ,Android客户端,我去，第一集完全可以没有啊
906551886,Zoujie96232063,,lv8,0, , ,Android客户端,好酸爽的广告
906548364,黑酱油老电视,,lv19,0, , ,iPhone客户端,广告适可而止就好…………………
906510355,437L,,lv38,0, , ,iPad客户端,都是一晚能看到底的烂梗
906505187,腾讯用户1462928016054367,,lv1,1, , ,优酷,曲筱绡就是个骗子哦，三观不正的女人。曲筱绡就是坏女人，乱抢被人的男友是一个十足的小三哦。曲筱绡就是个骗子哦，三观不正的女人。曲筱绡就是坏女人，乱抢被人的男友是一个十足的小三哦
906493859,,,lv30,0, , ,iPad客户端,&#039;
906493295,土豆用户_407987154,,lv12,0, , ,Android客户端,太多广告了，真烦
906489084,卍唾唾ing,,lv19,0,2, ,Android客户端,讨厌樊姐的赞一个
906487468,茶圖籽,,lv10,1, , ,优酷PC客户端,"<a href=""http:\/\/comments.youku.com\/star_page\/uid_UNjc2NzY=.html"" target=""_blank"">刘涛"
906461123,云清公子,,lv68,0, , ,iPad客户端,注会和会计证差很多好吗
906448845,mob_18662332951,,lv8,0, , ,Android客户端,真的假的！！！沙发！！！！
906441378,小蓝22017443,,lv4,0, , ,Android客户端,我觉得除了小曲丑一点其她
906434804,天锁斩月28949649,,lv13,0, , ,Android客户端,挺好看 不是脑残剧
906431394,甜蜜的负担84596915,,lv23,0, , ,优酷PC客户端,五个美女各有各的味道，喜欢这部电视连续剧，好久没有看到过那么好的连续剧了
906430355,优酷用户1461558998443336,,lv5,0, , ,优酷,看第二遍了，还是那么好看
906410792,妞给叔笑一个,,lv10,0, , ,Android客户端,靠！屌丝看这电视剧，情何以堪
906399452,_淤青好不了,,lv10,0, , ,优酷PC客户端,广告太长了
906398561,腾讯用户1463383356956966,,lv2,0,1, ,Android客户端,广告太多
906362669,泡泡醣,,lv12,0, , ,Android客户端,"<img src=""http:\/\/static.youku.com\/v1.0.157\/index\/img\/smiley\/Qoo12.gif"" alt=""搞笑"" title=""搞笑"" \/>"
906355526,,,lv46,0, , ,优酷PC客户端,怎么
906343492,腾讯用户1463481216774496,,lv1,0, , ,优酷PC客户端,受不了
906338162,腾讯用户1462277432242846,,lv3,0, , ,Android客户端,广告好长
906326520,微信用户1463242175894235,,lv4,0, , ,iPhone客户端,讨厌的广告
906325058,huangsuzhen1991,,lv17,0, , ,iPhone客户端,广告也太长了吧
906307093,蓝天08118364,,lv10,0, , ,Android客户端,唯品会广告出现了。鄙视
906302524,萌比i37878540,,lv11,0, , ,Android客户端,广告好多啊 受不了
906301445,niki282,,lv18,0, , ,iPad客户端,广告真烦
906290336,HelloKitty87498699,,lv6,0, , ,Android客户端,刚看就喜欢安迪！个人！个人
906286083,手机用户_727014514,,lv26,0, , ,Android客户端,广告这么长
906281547,,,lv11,0, , ,iPhone客户端,看两遍还看不够
906277440,孤独风景86916203,,lv12,0, , ,Android客户端,广告太多了
906261948,_沐淋山,,lv19,0, , ,Android客户端,😭这么多广告
906257127,兴业96667572,,lv10,0, , ,iPhone客户端,这广告真带劲
906129271,微信用户1463423278086700,,lv2,0, , ,iPhone客户端,这电视有男主角吗？
906118367,ぜ蜘ぷ猪,,lv7,0, , ,优酷,做女人，不容易，所以只有懂女人，才能更爱女人
906111376,cutle502,,lv47,0, , ,优酷,贝多芬第九交响乐叫啥来着
906060512,土豆用户_408909394,,lv22,0, , ,Android客户端,120广告(´･_･`)
906049663,爱自己18835583,,lv10,0, , ,Android客户端,带孩子都没时间看
906043926,习惯那些不曾习惯的习惯17002484,,lv23,0, , ,iPhone客户端,受不了了，片头一百多分钟的广告，看了一半还有一分钟的广告，真是够了
906041542,yumu0411,,lv34,0, , ,iPhone客户端,l
906019608,艾尔齐亚一世,,lv11,0, , ,iPad客户端,已转发评论
906003569,杨志星25542527,,lv2,0, , ,优酷PC客户端,。。。。。。。。
905973038,,,lv25,0, , ,优酷iku,"<a href=""http:\/\/comments.youku.com\/star_page\/uid_UODg0MTY=.html"" target=""_blank"">杨紫"
905950262,总有幸福在等你70420543,,lv5,0, , ,优酷,"<img src=""http:\/\/static.youku.com\/v1.0.157\/index\/img\/emotion\/xiaozhangfu\/xbmmd.gif"" alt=""小贝么么哒"" title=""小贝么么哒"" \/>"
905947475,飘渺々一族,,lv29,0, , ,优酷,"<a href=""http:\/\/comments.youku.com\/star_page\/uid_UODc2Mjg=.html"" target=""_blank"">王子文"
905936226,北城冥河,,lv9,0,1, ,优酷PC客户端,好烦邱莹莹啊！！！！
905877789,腾讯用户125896344442487329,,lv17,0, , ,Android客户端,一个流浪儿福利院长大的人既然是美国哥伦比亚大学毕业的，这也太假了吧。
905870080,鱼xk,,lv13,0, , ,iPad客户端,已转发评论
905867828,,,lv23,0,1, ,iPhone客户端,好多好多的季节
905855926,梦幻空花2014,,lv27,0, , ,优酷PC客户端,靠，重装一下优酷，尼玛，全是广告
905855770,狼牙57889981,,lv6,0, , ,优酷PC客户端,哈哈
905854409,腾讯用户1463376646520145,,lv1,0, , ,优酷PC客户端,好难过烦恼股份
905852028,猫猫0915,,lv38,0, , ,优酷iku,2236363
905843813,miss巅峰あ,,lv4,0, , ,优酷iku,"GG,沙发"
905811623,康語軒,,lv10,0, , ,优酷PC客户端,胡歌呢
905811497,todaygiftq,,lv15,0, , ,iPad客户端,已转发评论
905793016,苏州期缘,,lv20,0, , ,优酷iku,11
