id,user_name,user_privilege,level,reply_count,up_count,down_count,client_type,comment
895795303,土豆用户_372385580,,lv7,1, , ,iPhone客户端,干嘛要有旁白，，我也是醉了，，难听死了，，跟说故事一样，，还是不是电视剧，我们不会自己看嘛
895793676,阿沫ヽゝ,,lv7,0,1, ,Android客户端,嗯，就是皮肤有一点点黑
895793264,,,lv49,1,1, ,iPhone客户端,"<a href=""http:\/\/comments.youku.com\/star_page\/uid_UNjc2NzY=.html"" target=""_blank"">刘涛"
895792227,阿沫ヽゝ,,lv7,0,3, ,Android客户端,樊姐肯定喜欢那个王柏川
895791611,我爱大大大酷儿,,lv41,0,1, ,优酷,为什么这个男的不是他。。好可惜
895790563,阿沫ヽゝ,,lv7,0,1, ,Android客户端,已转发评论
895790367,阿沫ヽゝ,,lv7,1, , ,Android客户端,广告好长啊啊啊...
895790067,阿沫ヽゝ,,lv7,1,1, ,Android客户端,邱莹莹实在是太讨厌了！都这么大了！
895788867,土豆用户_692094370,,lv9,0,2, ,Android客户端,广告也太长了点吧，好不容易广告过了，来个剧太火网太弱，我也是醉了
895788597,腾讯用户1461319380118106,,lv4,0, , ,iPad客户端,已转发评论
895787633,,,lv17,0,1, ,iPhone客户端,旁白也是醉了 观众可以自己感受领会 干嘛要读出来 简直是败笔
895785807,筱韵水蜜桃,,lv21,0, , ,iPhone客户端,这个
895783701,懒猫83682366,,lv9,0,1, ,Android客户端,广告太长了……
895783623,嘉嘉16601688,,lv22,0, , ,iPad客户端,已转发评论
895779189,OL于欣,,lv11,0,2, ,iPhone客户端,真是神烦
895778617,支付宝用户57464666,,lv11,0,2, ,Android客户端,为什么会员还有广告？？？？
895776637,,,lv10,0,2, ,Android客户端,"<a href=""http:\/\/comments.youku.com\/star_page\/uid_UODg0MTY=.html"" target=""_blank"">杨紫"
895776432,,,lv10,0, , ,Android客户端,还可以
895776245,,,lv10,0, , ,Android客户端,呵呵呵
895772211,____39833311,,lv13,0,1, ,Android客户端,关关是不是有时候像刘亦菲啊
895770536,草帽天堂树,,lv17,0, , ,Android客户端,我还蛮喜欢
895766841,小可爱001001,,lv16,0, , ,Android客户端,秃头
895766822,小可爱001001,,lv16,0, , ,Android客户端,？？
895766658,小可爱001001,,lv16,0, , ,Android客户端,花龙八仙过海的
895766109,我爱你爱了整整一个曾经74176337,,lv3,0,1, ,优酷,五个女生里就不喜欢邱莹莹 烦死了 看着演员的脸都闹心= =
895765755,_95569780,,lv18,0, , ,iPad客户端,"<a href=""http:\/\/comments.youku.com\/star_page\/uid_UNjY2OTI=.html"" target=""_blank"">蒋欣"
895765364,_95569780,,lv18,0, , ,iPad客户端,"<a href=""http:\/\/comments.youku.com\/star_page\/uid_UNjY2OTI=.html"" target=""_blank"">蒋欣"
895762329,,,lv30,0,1, ,优酷,说了是
895759139,嫠女,,lv27,0, , ,优酷PC客户端,莹莹太天真了
895758379,,,lv20,0,1, ,iPhone客户端,那个什么邱的，人造脸配上剧情中的性格真是惹人嫌
895757798,,,lv20,0, , ,iPhone客户端,那个谁，什么邱的，整容了还是这么丑配上剧情中性格看到就烦
895757345,腾讯用户63772284,,lv23,0, , ,Android客户端,，
895754183,神叨侠侣58541291,,lv12,0, , ,iPhone客户端,"<a title=""点击从此时间点开始播放"" alt=""点击从此时间点开始播放"" href=""javascript:PlayerSeekMin('00','111');window.scroll(0,0)"">111秒"
895753369,左脸明媚右脸悲伤98870662,,lv5,0,1, ,优酷,"<a href=""http:\/\/comments.youku.com\/star_page\/uid_UNjY2OTI=.html"" target=""_blank"">蒋欣"
895751142,,,lv35,0,2, ,优酷iku,脑子进水的邱莹莹
895749277,神叨侠侣58541291,,lv12,0, , ,iPhone客户端,"<a title=""点击从此时间点开始播放"" alt=""点击从此时间点开始播放"" href=""javascript:PlayerSeekMin('00','110');window.scroll(0,0)"">110秒"
895749094,cjxbear,,lv30,0,1, ,iPad客户端,"<a href=""http:\/\/comments.youku.com\/star_page\/uid_UMTEyODUwMA==.html"" target=""_blank"">祖峰"
895748820,Yoki-林,,lv28,12,324, ,优酷iku,只有我觉得那套绿色的衣服不好看吗？显的华妃好胖。。
895748405,优酷用户860738482,,lv3,0, , ,iPad客户端,甭理他，他脑子xx了
895747924,尘_心,,lv19,0, , ,Android客户端,"<a title=""点击从此时间点开始播放"" alt=""点击从此时间点开始播放"" href=""javascript:PlayerSeekMin('00','110');window.scroll(0,0)"">110秒"
895747374,,,lv45,0, , ,优酷iku,我不知道我怕你什么呢？女强人1
895746867,玫琳凯---曹霞,,lv31,0, , ,优酷iku,已转发评论
895745872,玫琳凯---曹霞,,lv31,0, , ,优酷iku,干嘛这样说
895745449,,,lv55,0, , ,Android客户端,已转发评论
895745292,,,lv12,0, , ,优酷iku,为什么 是会员还要看广告啊
895743434,支付宝用户60631427,,lv7,0, , ,Android客户端,会员也那么多广告。
895743015,腾讯用户1461281965816365,,lv1,1,1, ,Android客户端,演白主管的是谁啊？不认识，不过演技还错！
895742330,错过ノ花开的季节,,lv20,0,2, ,优酷PC客户端,骂角色 说明演得好 骂演员就不对了
895741881,秦微时,,lv27,1,2, ,优酷iku,这白主管 有点眼熟，我好想在哪电视里见过似得。
895741343,土豆用户_410996519,,lv11,1, , ,优酷,那么多广告好烦人，
895741273,土豆用户_410996519,,lv11,0,1, ,优酷,什么情况啊那么多广告
895740075,残落的荒芜,,lv5,0,1, ,优酷iku,喜欢安迪，活得洒脱自由，有个性
895740017,勿忘初心02544685,,lv10,0,2, ,iPhone客户端,对啊，上升到演员就是人身攻击了
895739597,梦缘22197808,,lv17,0,2, ,优酷iku,真要命，剧组看来资金真是紧张啊，让我们的
895739416,fxseo网络营销培训,,lv13,0,1, ,优酷iku,来个胡歌霍建华就好了
895738067,,,lv30,0, , ,iPad客户端,换张一山演才是神作
895737854,,,lv29,0,1, ,Android客户端,太阳的后裔已过，欢乐颂来临 真是时候，还是，，，，
895737760,云哥77350365,,lv8,0, , ,Android客户端,挺好看的
895737676,,,lv29,0, , ,Android客户端,最后是不是都有自己的归属了！
895737308,,,lv30,0, , ,iPad客户端,呵呵，免费给你看，还不让人赚广告费？
895736864,晴天81761939,,lv4,0, , ,Android客户端,不喜欢
895736660,V80077235,,lv15,0, , ,优酷iku,感觉是
895736544,T被时光掩埋的秘密,,lv9,0, , ,iPhone客户端,那么多人讨厌邱莹莹证明
895736524,V80077235,,lv15,0, , ,优酷iku,哈哈，不是这个人吧
895736244,秋至叶飘零07266733,,lv20,0, , ,Android客户端,真的很好看呐
895735394,人质寓,,lv8,0, , ,iPad客户端,晕，太多广告了。
895734842,五玥咪,,lv15,0, , ,优酷iku,"<a href=""http:\/\/comments.youku.com\/star_page\/uid_UNjY2OTI=.html"" target=""_blank"">蒋欣"
895734732,拿着烟斗的男孩31808338,,lv28,0, , ,优酷iku,已转发评论
895734496,唱着RAP的花栗鼠,,lv13,1, , ,Android客户端,演技都挺好的，就是你们骂角色不要上升演员就好
895731495,优酷用户14612999553157,,lv2,0, , ,iPad客户端,，，，
895731466,,,lv28,0, , ,优酷PC客户端,"<a href=""http:\/\/comments.youku.com\/star_page\/uid_UNjc2NzY=.html"" target=""_blank"">刘涛"
895729323,V老议员,,lv33,0, , ,iPad客户端,安迪应该回国找
895728491,,,lv46,0, , ,iPhone客户端,邱莹莹那个假体鼻子也没谁了 任凭表情怎么变 鼻子就那么硬挺挺的杵在那儿
895726895,二姐22455658,,lv12,0, , ,iPhone客户端,看到
895726477,,,lv35,0, , ,优酷iku,好看！！！
895726453,,,lv27,0, , ,优酷iku,那不是有点傻 就是个傻叉
895725817,看透83063794,,lv19,0, , ,iPhone客户端,没想到
895725685,上善若水57942730,,lv8,1, , ,优酷iku,我想知道
895724164,,,lv36,0, , ,Android客户端,我想知道
895723132,,,lv16,0, , ,优酷iku,那个奇点，看手就知道是
895722988,鱼鱼齐全,,lv7,1, , ,iPhone客户端,他也算老演员了，戏演得不少，就是没火。
895722847,腾讯用户1461157730181365,,lv13,0, , ,iPhone客户端,"<a href=""http:\/\/comments.youku.com\/star_page\/uid_UNjc2NzY=.html"" target=""_blank"">刘涛"
895722707,鱼鱼齐全,,lv7,0, , ,iPhone客户端,优酷实在太不要脸了，这么长的广告不拿来骂几句都没事儿做。
895722311,胖子24541194,,lv10,0, , ,Android客户端,这旁白根本不必要，又不是看不懂，反而还破坏气氛。
895722046,Ophelia奥菲莉亚,,lv26,0, , ,iPad客户端,这不是潜伏里的佛龛嘛……
895721516,丶Perpormer,,lv16,0, , ,iPhone客户端,邱确实演技很差，太僵硬，人物设定也不是合理
895720958,士多啤梨03085416,,lv9,0, , ,iPhone客户端,广告真心又长又多
895720614,V老议员,,lv33,0, , ,iPad客户端,曲筱绡也是一个败家娘们，
895719347,uniaw,,lv12,0, , ,优酷iku,渣男 最讨厌这样的男生 什么事情都推到女朋友朋友的身上
895719277,小摩擦不断80509553,,lv3,0, , ,优酷iku,小蚯蚓有点傻
895717932,Kimiliu84219716,,lv3,0, , ,iPhone客户端,喜欢职场上的 安迪，气质优雅 着装风格都很
895717618,Kimiliu84219716,,lv3,0, , ,iPhone客户端,喜欢职场的 安迪！穿衣服 总是很有格调 气质优雅
895717476,,,lv27,0, , ,iPad客户端,每次旁边一念。我总觉得有变态杀手要出来
895717193,Fleming28264710,,lv7,0, , ,优酷PC客户端,"<a href=""http:\/\/comments.youku.com\/star_page\/uid_UNjY2OTI=.html"" target=""_blank"">蒋欣"
895717065,宝宝19449220,,lv20,0, , ,Android客户端,个人觉得
895716843,倾听色彩9,,lv44,0, , ,Android客户端,旁白的声音太没感觉了
895716832,A荏苒手绘小公举,,lv5,0, , ,Android客户端,当局者迷，旁观者清
895716680,,,lv23,0, , ,优酷iku,真的有这种傻姑娘，我觉得
895714065,爱你只是曾经30593516,,lv4,0, , ,优酷,不喜欢
895713334,命系小小得意ゝ,,lv16,0, , ,iPhone客户端,我凯什么时候出来呢？
895712806,,,lv45,0, , ,iPad客户端,"<a href=""http:\/\/comments.youku.com\/star_page\/uid_UODg0MTY=.html"" target=""_blank"">杨紫"
895712519,星空忘悠,,lv43,0, , ,iPhone客户端,笑死我了，好有趣啊
895710411,腾讯用户1461305803666141,,lv1,0, , ,优酷iku,我以为是凯凯咧
895710358,土豆用户_661421824,,lv12,0, , ,优酷,独白真是煞风景！！真难听
895709776,我是凤宝贝,,lv41,0, , ,优酷iku,古风
895709394,我是凤宝贝,,lv41,0, , ,优酷iku,讨厌小蚯蚓
895709335,qq2598716645,,lv37,1, , ,优酷,个人觉得东哥跟涛姐更配一点
895707616,包铁岭,,lv12,0, , ,iPad客户端,个人觉得
895707375,我们的约定73850498,,lv16,0, , ,优酷iku,安迪喝的农夫山泉玻璃装
895706284,佚名65629554,,lv8,1, , ,Android Pad客户端,奇点到底是谁演的？？？？？？？
895705608,,,lv24,0, , ,Android客户端,超好看
895705286,微信用户8704630988472068,,lv4,0, , ,Android客户端,不错
895705003,,,lv25,0, , ,Android客户端,嘿嘿。。。
895704339,春天小草11243304,,lv19,1, , ,Android客户端,这个奇点真让人失望
895704024,沉静的大山,,lv10,0, , ,优酷iku,都市中人，实际的很。
895703917,沉静的大山,,lv10,0, , ,优酷iku,同感。
895703539,来自1989的小七,,lv49,0, , ,优酷,旁白太恐怖，垃圾到极点
895702845,千寻6931,,lv16,0, , ,优酷iku,奇点 是挺有趣的哈
895701963,土豆用户_777352685,,lv7,0, , ,优酷iku,"<a href=""http:\/\/comments.youku.com\/star_page\/uid_UODg0MTY=.html"" target=""_blank"">杨紫"
895700388,csixshenm,,lv50,0, , ,优酷PC客户端,现实中还真的有这种白痴女孩
895700245,逗你玩泪,,lv10,0,2, ,iPad客户端,喜欢姚滨曲筱销的角色
895698769,佚名65629554,,lv8,0,1, ,Android Pad客户端,这剧我喜欢，很贴近现实，也让我们学会防患于未然
895698711,海狗是个好孩子,,lv27,0,1, ,优酷PC客户端,我觉得很美啊，正好。不觉得胖
895698683,武哥推荐,,lv90,0,2, ,iPad客户端,感觉
895698263,na1ut0,,lv20,0, , ,iPhone客户端,真的有 我朋友就是 劝了也不听
895697974,csixshenm,,lv50,0, , ,优酷PC客户端,那个邱莹莹真的是一个白痴，脑残，活该自己凄惨
895695516,,,lv19,0, , ,优酷iku,会员看视频没广告啊
895694927,听不见的风景gaga,,lv21,0, , ,iPad客户端,不喜欢
895694852,ゆ流苏Forget18869871,,lv8,0,1, ,优酷iku,樊姐 还美女
895691775,斗鱼TV福利视频,,lv23,1,1, ,iPhone客户端,总感觉王白川就是奇点
895689707,daisy_lyt0120,,lv13,0, , ,iPad客户端,邱莹莹太傻了，我怎么初中拍拖都没那么脑残
895688153,唐会玩,,lv46,0, , ,优酷iku,邱莹莹这个人设好做作啊。。受不了。而且觉得
895687582,xxg555,,lv7,0,1, ,Android客户端,白看了这么长时间广告，这集看过了
895686268,,,lv11,1, , ,iPhone客户端,失望啊奇点…
895686170,,,lv28,0,1, ,Android客户端,我家涛哥从开播到现在，喝了不少水啊！
895683052,半城繁华半城伤33748907,,lv6,0, , ,优酷PC客户端,我怎么没有广告呢！好奇怪啊
895681678,红叶子妹妹,,lv31,0, , ,优酷,喜欢安迪和樊姐
895679677,jackquline,,lv34,0, , ,iPhone客户端,生活中这种女孩真有，被甩了还闹自杀
895679329,列车班,,lv68,0,1, ,优酷,其实这小白追求自己想要的生活是没错，但就不应该这个搭着个姑娘，那边还三心两意的当别人的跑腿，当人家什么，还叫人家过去同居，又免费当一炮友，真心贱格
895677089,jackquline,,lv34,0,1, ,iPhone客户端,问题是她真的不瘦
895676862,文佳68554478,,lv8,0,3, ,Android客户端,喜欢
895676829,,,lv25,0, , ,优酷iku,"<a href=""http:\/\/comments.youku.com\/star_page\/uid_UODg0MTY=.html"" target=""_blank"">杨紫"
895675663,蛋蛋1321,,lv32,1,1, ,优酷iku,奇点的年龄。。。。。。。。。。。。有点大。。。。。。。。。。
895675228,jackquline,,lv34,0, , ,iPhone客户端,智商感人呐
895674590,,,lv40,0, , ,优酷,佛龛都出来了。。。。
895674577,ykmm12,,lv7,0, , ,Android客户端,这个广告多的，真是够了
895674260,大爱二哥二嫂,,lv12,0, , ,优酷PC客户端,哈哈哈哈，两个月那个手势太萌了
895673586,只是我不懂17867545,,lv6,0,1, ,Android客户端,好喜欢关关
895673341,大爱二哥二嫂,,lv12,0,1, ,优酷PC客户端,啊啊啊啊，那个谁王柏（bai）川，看wuli欣欣的神情之之之。。
895672189,春天小草11243304,,lv19,1,1, ,Android客户端,这个奇点是谁
895670608,jaymi188,,lv35,0, , ,优酷,娘娘挺圆润的嘛！！！
895668932,【坏孩子de天空】,,lv24,0, , ,优酷,个人觉得关关最好..
895668635,,,lv32,0, , ,Android客户端,"<a href=""http:\/\/comments.youku.com\/star_page\/uid_UMTEyODUwMA==.html"" target=""_blank"">祖峰"
895663759,,,lv26,0, , ,优酷iku,我觉得关关最漂亮呢
895663756,,,lv56,1, , ,iPhone客户端,这个奇点是那个秘书吗
895663571,北极看到星光,,lv26,0, , ,Android客户端,白主管好贱啊
895659549,多宁顿,,lv23,0, , ,iPad客户端,广告贼多，差评差评
895658035,,,lv26,0, , ,优酷,旁白真的是够了 旁白的声音配上台词 为何那么苏
895654358,优酷手机用户_65lr74yc,,lv20,0, , ,Android客户端,"<a href=""http:\/\/comments.youku.com\/star_page\/uid_UODg0MTY=.html"" target=""_blank"">杨紫"
895653315,疯子881,,lv22,0, , ,iPhone客户端,广告能再多点啊
895652240,宝球咪,,lv58,0, , ,优酷,"<a href=""http:\/\/comments.youku.com\/star_page\/uid_UNjY2OTI=.html"" target=""_blank"">蒋欣"
895652239,腾讯用户1461293484319864,,lv1,0, , ,Android客户端,詔打字文案每千字25想做的找8 3 7737652没事赚点零花，非诚勿扰～
895651862,zhensanderen,,lv29,0, , ,优酷PC客户端,"<a href=""http:\/\/comments.youku.com\/star_page\/uid_UNjc2NzY=.html"" target=""_blank"">刘涛"
895650966,_93677151,,lv4,0, , ,Android客户端,这广告也太短了点
895648407,柠檬哲宝,,lv18,0, , ,iPad客户端,已转发评论
895647280,,,lv26,0, , ,iPhone客户端,奇点真失望
895646725,优酷用户819950854,,lv13,0, , ,iPhone客户端,小说比电视剧吸引人 继续追书去了
895646429,嘿嘿嘿小番茄,,lv8,0, , ,iPhone客户端,这广告～～呵呵哒
895643498,,,lv65,0, , ,优酷iku,"<a href=""http:\/\/comments.youku.com\/star_page\/uid_UNjc2NzY=.html"" target=""_blank"">刘涛"
895640953,天水宫16937744,,lv18,0, , ,优酷iku,旁白是不是傻
895639764,风景如画29459132,,lv3,0, , ,Android客户端,卧槽，有钱人啊，那矿泉水杠杠滴！
895639705,飞天鳄鱼鲨,,lv27,0, , ,优酷,"<a href=""http:\/\/comments.youku.com\/star_page\/uid_UODg0MTY=.html"" target=""_blank"">杨紫"
895635288,houjie905,,lv39,0, , ,iPhone客户端,小蚯蚓真2⃣️
895633180,不吃渔的喵,,lv20,0, , ,优酷,最近追的剧！昨儿刚把小说下下来，正在纠结要不要看
895632536,银68097613,,lv7,0, , ,Android客户端,"<a href=""http:\/\/comments.youku.com\/star_page\/uid_UODg0MTY=.html"" target=""_blank"">杨紫"
895630595,Fortresesieged06724982,,lv6,0, , ,Android客户端,喜欢安迪，喜欢
895630227,sadfseg,,lv20,2, , ,iPad客户端,以前很喜欢
895629776,花被子89807386,,lv5,0, , ,iPhone客户端,好看，加smilema带你一起欢乐颂
895625113,咸菜夫,,lv24,0, , ,优酷,"艾 电视剧有点那个啥 这租的房子还算差？ 相信在现实生活中,,对于我们普通人来说已经挺豪华的了"
895624789,煙菋o浅,,lv16,0, , ,Android客户端,这广告真可以啊。。。赚钱么？
895624312,ss48932373,,lv1,0, , ,iPad客户端,我家凯凯呢
895623670,小妞99332060,,lv11,1, , ,iPhone客户端,和安迪聊天男的声音就像吴京！
895622538,土豆用户_462297785,,lv11,0, , ,Android客户端,看小公举的广告都感觉好幸福→_→
895621554,腾讯用户1461284353043212,,lv3,0, , ,Android客户端,对男主太失望！！
895621449,腾讯用户1461284353043212,,lv3,0, , ,Android客户端,表告诉我这是男主！！！！！！
895621154,仅有的依赖05482834,,lv4,0, , ,Android客户端,喜欢
895620520,,,lv26,0, , ,iPhone客户端,矿泉水都是几十一瓶的
895615380,,,lv10,0, , ,Android客户端,我也是醉了
895615281,,,lv10,0, , ,Android客户端,广告好少啊
895612371,高冷正能量软妹,,lv18,0, , ,iPhone客户端,让她们其中两个有女同的情绪会更有看点
895609020,腾讯用户1461277267786575,,lv7,0, , ,iPad客户端,这樊姐什么年纪啊，跟一这么年轻的同学？装嫩啊？老姑婆了都
895608698,,,lv36,0, , ,iPhone客户端,他范贱我乐意哈哈
895607849,微信用户0486570056789492,,lv9,0, , ,Android客户端,老子想飞起一脚
895607054,,,lv26,0, , ,iPhone客户端,傻白甜嘛…
895604662,腾讯用户1461171427413258,,lv5,0, , ,iPhone客户端,我是来看广告的😂
895603950,冷心冷血冷温柔51231611,,lv6,1, , ,iPad客户端,"<a href=""http:\/\/comments.youku.com\/star_page\/uid_UNzc2MzI4.html"" target=""_blank"">王凯"
895603588,杀千陌的花千骨,,lv9,0, , ,Android客户端,很反感邱莹莹这个角色
895603444,土豆用户_378382114,,lv4,12, , ,Android Pad客户端,我来剧透，奇点是白主管。。
895603097,语笑嫣然47688806,,lv6,0, , ,iPad客户端,已转发评论
895603077,语笑嫣然47688806,,lv6,0, , ,iPad客户端,已转发评论
895603052,语笑嫣然47688806,,lv6,1, , ,iPad客户端,已转发评论
895600545,a一個人的等待,,lv9,0, , ,Android客户端,我操(;｀O´)o太它妈多广告了，
895600074,-果果ヾlove,,lv21,0, , ,Android客户端,广告太特马多了，讨厌死了
895599088,微信用户14612645131140,,lv1,0, , ,Android客户端,五个不同层面的女人，不知道自己将会属于哪个层面，迷茫～
895598803,亭亭92623291,,lv6,0, , ,Android客户端,等着凯凯王
895598155,守護☆星☆,,lv15,1, , ,Android客户端,如果这部剧没有男人就好了
895598101,没有没有0904,,lv8,0, , ,iPhone客户端,广告你敢不敢再长一点
895598092,ajin380438,,lv31,0, , ,iPhone客户端,演的跟个弱智一样，这点道理都不懂
895597211,优酷手机用户_Q8qGxUP5,,lv6,0, , ,iPhone客户端,这男主谁啊，老是犹抱琵琶半遮面的
895596450,文艺青年小崔崔,,lv21,0, , ,优酷,奇点❤
895594812,简单小幸福44155587,,lv3,0,2, ,Android客户端,广告也太长了吧，而且中间还有广告，优酷越来越不厚道了！！
895594642,game_o3nadd,,lv11,0,4, ,Android客户端,每次广告那么长，把人哲痛死！！！！！😭
895594579,game_o3nadd,,lv11,0,2, ,Android客户端,无聊！！
895593785,陌若_安生,,lv28,0,2, ,Android客户端,喜欢
895591769,肚子胀了,,lv26,1,2, ,iPhone客户端,"<a href=""http:\/\/comments.youku.com\/star_page\/uid_UNjY2OTI=.html"" target=""_blank"">蒋欣"
895591603,divine1212,,lv31,0,1, ,Android客户端,原来是李崖。。。
895591395,,,lv12,0, , ,优酷,什么情况，邱莹莹带的不是苹果6嘛？怎么到餐厅变成别的手机了？
895591171,,,lv16,0, , ,Android客户端,旁白什么的真让人讨厌
895590718,,,lv17,0,1, ,iPad客户端,不是
895590340,优酷手机用户_h5hytzpj,,lv19,0,2, ,Android客户端,邱莹莹就是个白痴
895589069,DeSperaTeStruGGle10554756,,lv20,0, , ,优酷,一天一个保时捷 ，车牌都换了 沪 N 一个沪Q
895588404,肚子胀了,,lv26,0, , ,iPhone客户端,怎么手机一会儿换一个！
895588118,土豆用户_819301206,,lv5,0,3, ,Android客户端,还是喜欢关关那样。干净，上进……其他的真心不好评价。
895586423,,,lv17,0, , ,iPhone客户端,娘娘演的也很到位
895584229,,,lv12,0,1, ,iPad客户端,"<a href=""http:\/\/comments.youku.com\/star_page\/uid_UODg0MTY=.html"" target=""_blank"">杨紫"
895584053,,,lv35,0,3, ,Android客户端,"<a href=""http:\/\/comments.youku.com\/star_page\/uid_UODg0MTY=.html"" target=""_blank"">杨紫"
895583735,_118922812,,lv11,0, , ,iPhone客户端,很喜欢。喜欢
895583038,滴滴滴10958558,,lv34,0,1, ,iPhone客户端,这部戏的角色塑造的很有意思
895581851,EllenJueliQ,,lv19,0,17, ,iPhone客户端,邱莹莹？智障？？？真是一个失败的人物角色啊。
895581646,,,lv25,0,1, ,iPhone客户端,说明
895578100,红尘一醉123,,lv13,0,1, ,Android客户端,奇点手的皮肤比脸皮肤好多了
895577992,玲☆子,,lv30,0,1, ,iPad客户端,她演的角色是这样的，没必要针对演员
895576641,ゝ嗨ngJi,,lv9,0,1, ,Android客户端,"<a href=""http:\/\/comments.youku.com\/star_page\/uid_UODg0MTY=.html"" target=""_blank"">杨紫"
895575912,,,lv17,0, , ,iPhone客户端,"<a href=""http:\/\/comments.youku.com\/star_page\/uid_UNjY2OTI=.html"" target=""_blank"">蒋欣"
895575823,很婵娟,,lv13,0,2, ,Android客户端,奇点，看背后好帅啊，霸道总裁型呀，
895574953,优酷院线69248270,,lv20,1,2, ,iPad客户端,讨厌可以不看，没人逼着你看
895574949,六代六太,,lv12,0, , ,Android Pad客户端,纪王爷……哈哈哈哈
895572261,女人不醉男人没机会15166359,,lv13,0,1, ,Android客户端,会员肿么还要广告啊太坑爹了啊
895571546,,,lv35,0, , ,iPhone客户端,旁白让我出戏，演员完全有这个演技将旁白的内容表现出来啊，好不好
895570608,Leona43193262,,lv4,0,1, ,Android客户端,我觉得
895570521,angelalijm,,lv20,0, , ,iPad客户端,已转发评论
895570476,congmao聪,,lv25,1, , ,优酷,以前都看
895569559,Leona43193262,,lv4,0, , ,Android客户端,好烦人的广告啊😱杰伦你只管呆萌好了 我要看剧看剧看剧
895568410,紫空下的许愿少女,,lv11,0, , ,iPhone客户端,"<a href=""http:\/\/comments.youku.com\/star_page\/uid_UODg0MTY=.html"" target=""_blank"">杨紫"
895568089,唐渣渣08469645,,lv14,0, , ,Android客户端,广告看得我像弃剧了
895567915,唐渣渣08469645,,lv14,0, , ,Android客户端,卧槽！中间也有广告！
895566598,云朵儿231,,lv16,0, , ,Android客户端,真心讨厌广告
895566277,红尘一醉123,,lv13,0, , ,Android客户端,演就行了，为什么要有那么多难听又苍白的独白
895565314,优酷用户807598638,,lv13,0, , ,iPad客户端,最喜欢
895565108,,,lv16,0, , ,Android Pad客户端,看广告多长就知道优酷花了多少买版权
895564724,优酷用户1461248462497628,,lv9,1, , ,iPhone客户端,喜欢朱涛，大赞
895564537,颖菇凉11475134,,lv6,0, , ,Android客户端,"<a href=""http:\/\/comments.youku.com\/star_page\/uid_UNjY2OTI=.html"" target=""_blank"">蒋欣"
895563076,,,lv25,0, , ,优酷,女孩子傻傻的就那几年青春了，我觉得挺难得的，再过几年了就不一定能回到那个年纪了吧
895561484,,,lv18,0, , ,iPad客户端,奇点好闲啊～
895561457,汤圆64718862,,lv23,0, , ,Android客户端,不过很羡慕他们5个这样的室友呢
895561210,汤圆64718862,,lv23,0, , ,Android客户端,一个甜甜圈就收买了。。唉无语了
895558984,乱世佳人123456999,,lv22,0, , ,优酷,这么多破字幕这电视剧怎么看啊
895558482,奔跑的烤肉87440948,,lv10,0, , ,iPhone客户端,"<a href=""http:\/\/comments.youku.com\/star_page\/uid_UODg0MTY=.html"" target=""_blank"">杨紫"
895558289,奔跑的烤肉87440948,,lv10,0, , ,iPhone客户端,"<a href=""http:\/\/comments.youku.com\/star_page\/uid_UODg0MTY=.html"" target=""_blank"">杨紫"
895556015,我62169258,,lv2,0, , ,iPhone客户端,我不能评论？
895555435,悠悠12492242,,lv8,1, , ,iPad客户端,已转发评论
895555196,红尘一醉123,,lv13,0, , ,Android客户端,看清男友真实面目，她非但不感谢还像泼妇一样，真不可理喻，本来嘛，她和小曲比，是个男人都会选择小曲这样的白富美的一下子就看了五集了
895554850,奔跑的烤肉87440948,,lv10,0, , ,iPhone客户端,"<a href=""http:\/\/comments.youku.com\/star_page\/uid_UODg0MTY=.html"" target=""_blank"">杨紫"
895554671,Ai娜娜68308306,,lv10,0, , ,Android客户端,小蚯蚓眼瞎了吧，看上白主管 带着猥琐的样子
